name,cost,center,process,nearme
Abdominal Aortic Aneurysm Diagnosis,Abdominal Aortic Aneurysm Diagnosis Cost,Abdominal Aortic Aneurysm Diagnosis Center,Abdominal Aortic Aneurysm Diagnosis Center,Abdominal Aortic Aneurysm Diagnosis Near Me
Abdominal Distension Differential Diagnosis,Abdominal Distension Differential Diagnosis Cost,Abdominal Distension Differential Diagnosis Center,Abdominal Distension Differential Diagnosis Center,Abdominal Distension Differential Diagnosis Near Me
Abdominal Mass Differential Diagnosis,Abdominal Mass Differential Diagnosis Cost,Abdominal Mass Differential Diagnosis Center,Abdominal Mass Differential Diagnosis Center,Abdominal Mass Differential Diagnosis Near Me
Abdominal Pain Diagnosis,Abdominal Pain Diagnosis Cost,Abdominal Pain Diagnosis Center,Abdominal Pain Diagnosis Center,Abdominal Pain Diagnosis Near Me
Abdominal Pain Differential Diagnosis,Abdominal Pain Differential Diagnosis Cost,Abdominal Pain Differential Diagnosis Center,Abdominal Pain Differential Diagnosis Center,Abdominal Pain Differential Diagnosis Near Me
Abdominal Tb Diagnosis,Abdominal Tb Diagnosis Cost,Abdominal Tb Diagnosis Center,Abdominal Tb Diagnosis Center,Abdominal Tb Diagnosis Near Me
Abpa Diagnosis,Abpa Diagnosis Cost,Abpa Diagnosis Center,Abpa Diagnosis Center,Abpa Diagnosis Near Me
Achalasia Diagnosis,Achalasia Diagnosis Cost,Achalasia Diagnosis Center,Achalasia Diagnosis Center,Achalasia Diagnosis Near Me
Acromegaly Diagnosis,Acromegaly Diagnosis Cost,Acromegaly Diagnosis Center,Acromegaly Diagnosis Center,Acromegaly Diagnosis Near Me
Acs Diagnosis,Acs Diagnosis Cost,Acs Diagnosis Center,Acs Diagnosis Center,Acs Diagnosis Near Me
Acute Abdomen Differential Diagnosis,Acute Abdomen Differential Diagnosis Cost,Acute Abdomen Differential Diagnosis Center,Acute Abdomen Differential Diagnosis Center,Acute Abdomen Differential Diagnosis Near Me
Acute Cholecystitis Diagnosis,Acute Cholecystitis Diagnosis Cost,Acute Cholecystitis Diagnosis Center,Acute Cholecystitis Diagnosis Center,Acute Cholecystitis Diagnosis Near Me
Acute Coronary Syndrome Diagnosis,Acute Coronary Syndrome Diagnosis Cost,Acute Coronary Syndrome Diagnosis Center,Acute Coronary Syndrome Diagnosis Center,Acute Coronary Syndrome Diagnosis Near Me
Acute Kidney Injury Diagnosis,Acute Kidney Injury Diagnosis Cost,Acute Kidney Injury Diagnosis Center,Acute Kidney Injury Diagnosis Center,Acute Kidney Injury Diagnosis Near Me
Acute Kidney Injury Nursing Diagnosis,Acute Kidney Injury Nursing Diagnosis Cost,Acute Kidney Injury Nursing Diagnosis Center,Acute Kidney Injury Nursing Diagnosis Center,Acute Kidney Injury Nursing Diagnosis Near Me
Acute Myeloid Leukemia Diagnosis,Acute Myeloid Leukemia Diagnosis Cost,Acute Myeloid Leukemia Diagnosis Center,Acute Myeloid Leukemia Diagnosis Center,Acute Myeloid Leukemia Diagnosis Near Me
Acute Pancreatitis Diagnosis,Acute Pancreatitis Diagnosis Cost,Acute Pancreatitis Diagnosis Center,Acute Pancreatitis Diagnosis Center,Acute Pancreatitis Diagnosis Near Me
Acute Pyelonephritis Diagnosis,Acute Pyelonephritis Diagnosis Cost,Acute Pyelonephritis Diagnosis Center,Acute Pyelonephritis Diagnosis Center,Acute Pyelonephritis Diagnosis Near Me
Acute Renal Failure Diagnosis,Acute Renal Failure Diagnosis Cost,Acute Renal Failure Diagnosis Center,Acute Renal Failure Diagnosis Center,Acute Renal Failure Diagnosis Near Me
Acute Renal Failure Nursing Diagnosis,Acute Renal Failure Nursing Diagnosis Cost,Acute Renal Failure Nursing Diagnosis Center,Acute Renal Failure Nursing Diagnosis Center,Acute Renal Failure Nursing Diagnosis Near Me
Addison Disease Diagnosis,Addison Disease Diagnosis Cost,Addison Disease Diagnosis Center,Addison Disease Diagnosis Center,Addison Disease Diagnosis Near Me
Adenomyosis Diagnosis,Adenomyosis Diagnosis Cost,Adenomyosis Diagnosis Center,Adenomyosis Diagnosis Center,Adenomyosis Diagnosis Near Me
Adult Autism Diagnosis,Adult Autism Diagnosis Cost,Adult Autism Diagnosis Center,Adult Autism Diagnosis Center,Adult Autism Diagnosis Near Me
Afib Diagnosis,Afib Diagnosis Cost,Afib Diagnosis Center,Afib Diagnosis Center,Afib Diagnosis Near Me
Afib Nursing Diagnosis,Afib Nursing Diagnosis Cost,Afib Nursing Diagnosis Center,Afib Nursing Diagnosis Center,Afib Nursing Diagnosis Near Me
Aki Diagnosis,Aki Diagnosis Cost,Aki Diagnosis Center,Aki Diagnosis Center,Aki Diagnosis Near Me
Aki Nursing Diagnosis,Aki Nursing Diagnosis Cost,Aki Nursing Diagnosis Center,Aki Nursing Diagnosis Center,Aki Nursing Diagnosis Near Me
Alcoholic Hepatitis Diagnosis,Alcoholic Hepatitis Diagnosis Cost,Alcoholic Hepatitis Diagnosis Center,Alcoholic Hepatitis Diagnosis Center,Alcoholic Hepatitis Diagnosis Near Me
All Diagnosis,All Diagnosis Cost,All Diagnosis Center,All Diagnosis Center,All Diagnosis Near Me
Alpha Thalassemia Diagnosis,Alpha Thalassemia Diagnosis Cost,Alpha Thalassemia Diagnosis Center,Alpha Thalassemia Diagnosis Center,Alpha Thalassemia Diagnosis Near Me
Alzheimer'S Diagnosis,Alzheimer'S Diagnosis Cost,Alzheimer'S Diagnosis Center,Alzheimer'S Diagnosis Center,Alzheimer'S Diagnosis Near Me
Aml Diagnosis,Aml Diagnosis Cost,Aml Diagnosis Center,Aml Diagnosis Center,Aml Diagnosis Near Me
Ams Diagnosis,Ams Diagnosis Cost,Ams Diagnosis Center,Ams Diagnosis Center,Ams Diagnosis Near Me
Amyloidosis Diagnosis,Amyloidosis Diagnosis Cost,Amyloidosis Diagnosis Center,Amyloidosis Diagnosis Center,Amyloidosis Diagnosis Near Me
Anemia Diagnosis,Anemia Diagnosis Cost,Anemia Diagnosis Center,Anemia Diagnosis Center,Anemia Diagnosis Near Me
Anemia Differential Diagnosis,Anemia Differential Diagnosis Cost,Anemia Differential Diagnosis Center,Anemia Differential Diagnosis Center,Anemia Differential Diagnosis Near Me
Anemia Nursing Diagnosis,Anemia Nursing Diagnosis Cost,Anemia Nursing Diagnosis Center,Anemia Nursing Diagnosis Center,Anemia Nursing Diagnosis Near Me
Aneurysm Diagnosis,Aneurysm Diagnosis Cost,Aneurysm Diagnosis Center,Aneurysm Diagnosis Center,Aneurysm Diagnosis Near Me
Angina Diagnosis,Angina Diagnosis Cost,Angina Diagnosis Center,Angina Diagnosis Center,Angina Diagnosis Near Me
Angina Pectoris Diagnosis,Angina Pectoris Diagnosis Cost,Angina Pectoris Diagnosis Center,Angina Pectoris Diagnosis Center,Angina Pectoris Diagnosis Near Me
Ankle Pain Diagnosis,Ankle Pain Diagnosis Cost,Ankle Pain Diagnosis Center,Ankle Pain Diagnosis Center,Ankle Pain Diagnosis Near Me
Ankylosing Spondylitis Diagnosis,Ankylosing Spondylitis Diagnosis Cost,Ankylosing Spondylitis Diagnosis Center,Ankylosing Spondylitis Diagnosis Center,Ankylosing Spondylitis Diagnosis Near Me
Antiphospholipid Syndrome Diagnosis,Antiphospholipid Syndrome Diagnosis Cost,Antiphospholipid Syndrome Diagnosis Center,Antiphospholipid Syndrome Diagnosis Center,Antiphospholipid Syndrome Diagnosis Near Me
Anxiety Diagnosis,Anxiety Diagnosis Cost,Anxiety Diagnosis Center,Anxiety Diagnosis Center,Anxiety Diagnosis Near Me
Anxiety Disorder Diagnosis,Anxiety Disorder Diagnosis Cost,Anxiety Disorder Diagnosis Center,Anxiety Disorder Diagnosis Center,Anxiety Disorder Diagnosis Near Me
Anxiety Related To Nursing Diagnosis,Anxiety Related To Nursing Diagnosis Cost,Anxiety Related To Nursing Diagnosis Center,Anxiety Related To Nursing Diagnosis Center,Anxiety Related To Nursing Diagnosis Near Me
Aortic Aneurysm Diagnosis,Aortic Aneurysm Diagnosis Cost,Aortic Aneurysm Diagnosis Center,Aortic Aneurysm Diagnosis Center,Aortic Aneurysm Diagnosis Near Me
Aortic Dissection Diagnosis,Aortic Dissection Diagnosis Cost,Aortic Dissection Diagnosis Center,Aortic Dissection Diagnosis Center,Aortic Dissection Diagnosis Near Me
Aortic Stenosis Diagnosis,Aortic Stenosis Diagnosis Cost,Aortic Stenosis Diagnosis Center,Aortic Stenosis Diagnosis Center,Aortic Stenosis Diagnosis Near Me
Aplastic Anemia Diagnosis,Aplastic Anemia Diagnosis Cost,Aplastic Anemia Diagnosis Center,Aplastic Anemia Diagnosis Center,Aplastic Anemia Diagnosis Near Me
Appendicitis Diagnosis,Appendicitis Diagnosis Cost,Appendicitis Diagnosis Center,Appendicitis Diagnosis Center,Appendicitis Diagnosis Near Me
Appendicitis Differential Diagnosis,Appendicitis Differential Diagnosis Cost,Appendicitis Differential Diagnosis Center,Appendicitis Differential Diagnosis Center,Appendicitis Differential Diagnosis Near Me
Appendix Diagnosis,Appendix Diagnosis Cost,Appendix Diagnosis Center,Appendix Diagnosis Center,Appendix Diagnosis Near Me
Aps Diagnosis,Aps Diagnosis Cost,Aps Diagnosis Center,Aps Diagnosis Center,Aps Diagnosis Near Me
Ards Diagnosis,Ards Diagnosis Cost,Ards Diagnosis Center,Ards Diagnosis Center,Ards Diagnosis Near Me
Arrhythmia Diagnosis,Arrhythmia Diagnosis Cost,Arrhythmia Diagnosis Center,Arrhythmia Diagnosis Center,Arrhythmia Diagnosis Near Me
Arthritis Diagnosis,Arthritis Diagnosis Cost,Arthritis Diagnosis Center,Arthritis Diagnosis Center,Arthritis Diagnosis Near Me
As Diagnosis,As Diagnosis Cost,As Diagnosis Center,As Diagnosis Center,As Diagnosis Near Me
Asbestosis Diagnosis,Asbestosis Diagnosis Cost,Asbestosis Diagnosis Center,Asbestosis Diagnosis Center,Asbestosis Diagnosis Near Me
Ascites Diagnosis,Ascites Diagnosis Cost,Ascites Diagnosis Center,Ascites Diagnosis Center,Ascites Diagnosis Near Me
Ascites Differential Diagnosis,Ascites Differential Diagnosis Cost,Ascites Differential Diagnosis Center,Ascites Differential Diagnosis Center,Ascites Differential Diagnosis Near Me
Asperger'S Diagnosis,Asperger'S Diagnosis Cost,Asperger'S Diagnosis Center,Asperger'S Diagnosis Center,Asperger'S Diagnosis Near Me
Aspergillosis Diagnosis,Aspergillosis Diagnosis Cost,Aspergillosis Diagnosis Center,Aspergillosis Diagnosis Center,Aspergillosis Diagnosis Near Me
Asthma Diagnosis,Asthma Diagnosis Cost,Asthma Diagnosis Center,Asthma Diagnosis Center,Asthma Diagnosis Near Me
Atherosclerosis Diagnosis,Atherosclerosis Diagnosis Cost,Atherosclerosis Diagnosis Center,Atherosclerosis Diagnosis Center,Atherosclerosis Diagnosis Near Me
Atrial Fibrillation Diagnosis,Atrial Fibrillation Diagnosis Cost,Atrial Fibrillation Diagnosis Center,Atrial Fibrillation Diagnosis Center,Atrial Fibrillation Diagnosis Near Me
Atrial Fibrillation Nursing Diagnosis,Atrial Fibrillation Nursing Diagnosis Cost,Atrial Fibrillation Nursing Diagnosis Center,Atrial Fibrillation Nursing Diagnosis Center,Atrial Fibrillation Nursing Diagnosis Near Me
Autism Diagnosis,Autism Diagnosis Cost,Autism Diagnosis Center,Autism Diagnosis Center,Autism Diagnosis Near Me
Autoimmune Disease Diagnosis,Autoimmune Disease Diagnosis Cost,Autoimmune Disease Diagnosis Center,Autoimmune Disease Diagnosis Center,Autoimmune Disease Diagnosis Near Me
Autoimmune Hepatitis Diagnosis,Autoimmune Hepatitis Diagnosis Cost,Autoimmune Hepatitis Diagnosis Center,Autoimmune Hepatitis Diagnosis Center,Autoimmune Hepatitis Diagnosis Near Me
Avm Diagnosis,Avm Diagnosis Cost,Avm Diagnosis Center,Avm Diagnosis Center,Avm Diagnosis Near Me
Back Pain Diagnosis,Back Pain Diagnosis Cost,Back Pain Diagnosis Center,Back Pain Diagnosis Center,Back Pain Diagnosis Near Me
Back Pain Differential Diagnosis,Back Pain Differential Diagnosis Cost,Back Pain Differential Diagnosis Center,Back Pain Differential Diagnosis Center,Back Pain Differential Diagnosis Near Me
Bacterial Vaginosis Diagnosis,Bacterial Vaginosis Diagnosis Cost,Bacterial Vaginosis Diagnosis Center,Bacterial Vaginosis Diagnosis Center,Bacterial Vaginosis Diagnosis Near Me
Bipolar Diagnosis,Bipolar Diagnosis Cost,Bipolar Diagnosis Center,Bipolar Diagnosis Center,Bipolar Diagnosis Near Me
Bipolar Disorder Diagnosis,Bipolar Disorder Diagnosis Cost,Bipolar Disorder Diagnosis Center,Bipolar Disorder Diagnosis Center,Bipolar Disorder Diagnosis Near Me
Black Fungus Diagnosis,Black Fungus Diagnosis Cost,Black Fungus Diagnosis Center,Black Fungus Diagnosis Center,Black Fungus Diagnosis Near Me
Bladder Cancer Diagnosis,Bladder Cancer Diagnosis Cost,Bladder Cancer Diagnosis Center,Bladder Cancer Diagnosis Center,Bladder Cancer Diagnosis Near Me
Blanching Rash Differential Diagnosis,Blanching Rash Differential Diagnosis Cost,Blanching Rash Differential Diagnosis Center,Blanching Rash Differential Diagnosis Center,Blanching Rash Differential Diagnosis Near Me
Bleeding Nursing Diagnosis,Bleeding Nursing Diagnosis Cost,Bleeding Nursing Diagnosis Center,Bleeding Nursing Diagnosis Center,Bleeding Nursing Diagnosis Near Me
Blood Cancer Diagnosis,Blood Cancer Diagnosis Cost,Blood Cancer Diagnosis Center,Blood Cancer Diagnosis Center,Blood Cancer Diagnosis Near Me
Blood Clot Diagnosis,Blood Clot Diagnosis Cost,Blood Clot Diagnosis Center,Blood Clot Diagnosis Center,Blood Clot Diagnosis Near Me
Bone Cancer Diagnosis,Bone Cancer Diagnosis Cost,Bone Cancer Diagnosis Center,Bone Cancer Diagnosis Center,Bone Cancer Diagnosis Near Me
Bowel Cancer Diagnosis,Bowel Cancer Diagnosis Cost,Bowel Cancer Diagnosis Center,Bowel Cancer Diagnosis Center,Bowel Cancer Diagnosis Near Me
Bpad Diagnosis,Bpad Diagnosis Cost,Bpad Diagnosis Center,Bpad Diagnosis Center,Bpad Diagnosis Near Me
Brain Tumor Diagnosis,Brain Tumor Diagnosis Cost,Brain Tumor Diagnosis Center,Brain Tumor Diagnosis Center,Brain Tumor Diagnosis Near Me
Bronchial Asthma Diagnosis,Bronchial Asthma Diagnosis Cost,Bronchial Asthma Diagnosis Center,Bronchial Asthma Diagnosis Center,Bronchial Asthma Diagnosis Near Me
Bronchiectasis Diagnosis,Bronchiectasis Diagnosis Cost,Bronchiectasis Diagnosis Center,Bronchiectasis Diagnosis Center,Bronchiectasis Diagnosis Near Me
Bronchitis Diagnosis,Bronchitis Diagnosis Cost,Bronchitis Diagnosis Center,Bronchitis Diagnosis Center,Bronchitis Diagnosis Near Me
Brucellosis Diagnosis,Brucellosis Diagnosis Cost,Brucellosis Diagnosis Center,Brucellosis Diagnosis Center,Brucellosis Diagnosis Near Me
Bv Diagnosis,Bv Diagnosis Cost,Bv Diagnosis Center,Bv Diagnosis Center,Bv Diagnosis Near Me
C Diff Diagnosis,C Diff Diagnosis Cost,C Diff Diagnosis Center,C Diff Diagnosis Center,C Diff Diagnosis Near Me
Cad Diagnosis,Cad Diagnosis Cost,Cad Diagnosis Center,Cad Diagnosis Center,Cad Diagnosis Near Me
Cad Nursing Diagnosis,Cad Nursing Diagnosis Cost,Cad Nursing Diagnosis Center,Cad Nursing Diagnosis Center,Cad Nursing Diagnosis Near Me
Cancer Diagnosis,Cancer Diagnosis Cost,Cancer Diagnosis Center,Cancer Diagnosis Center,Cancer Diagnosis Near Me
Cap Diagnosis,Cap Diagnosis Cost,Cap Diagnosis Center,Cap Diagnosis Center,Cap Diagnosis Near Me
Carcinoid Syndrome Diagnosis,Carcinoid Syndrome Diagnosis Cost,Carcinoid Syndrome Diagnosis Center,Carcinoid Syndrome Diagnosis Center,Carcinoid Syndrome Diagnosis Near Me
Cardiac Diagnosis,Cardiac Diagnosis Cost,Cardiac Diagnosis Center,Cardiac Diagnosis Center,Cardiac Diagnosis Near Me
Carpal Tunnel Diagnosis,Carpal Tunnel Diagnosis Cost,Carpal Tunnel Diagnosis Center,Carpal Tunnel Diagnosis Center,Carpal Tunnel Diagnosis Near Me
Carpal Tunnel Syndrome Diagnosis,Carpal Tunnel Syndrome Diagnosis Cost,Carpal Tunnel Syndrome Diagnosis Center,Carpal Tunnel Syndrome Diagnosis Center,Carpal Tunnel Syndrome Diagnosis Near Me
Cataract Diagnosis,Cataract Diagnosis Cost,Cataract Diagnosis Center,Cataract Diagnosis Center,Cataract Diagnosis Near Me
Cataract Nursing Diagnosis,Cataract Nursing Diagnosis Cost,Cataract Nursing Diagnosis Center,Cataract Nursing Diagnosis Center,Cataract Nursing Diagnosis Near Me
Celiac Diagnosis,Celiac Diagnosis Cost,Celiac Diagnosis Center,Celiac Diagnosis Center,Celiac Diagnosis Near Me
Celiac Disease Diagnosis,Celiac Disease Diagnosis Cost,Celiac Disease Diagnosis Center,Celiac Disease Diagnosis Center,Celiac Disease Diagnosis Near Me
Cellulitis Diagnosis,Cellulitis Diagnosis Cost,Cellulitis Diagnosis Center,Cellulitis Diagnosis Center,Cellulitis Diagnosis Near Me
Cellulitis Differential Diagnosis,Cellulitis Differential Diagnosis Cost,Cellulitis Differential Diagnosis Center,Cellulitis Differential Diagnosis Center,Cellulitis Differential Diagnosis Near Me
Cellulitis Nursing Diagnosis,Cellulitis Nursing Diagnosis Cost,Cellulitis Nursing Diagnosis Center,Cellulitis Nursing Diagnosis Center,Cellulitis Nursing Diagnosis Near Me
Cerebral Palsy Diagnosis,Cerebral Palsy Diagnosis Cost,Cerebral Palsy Diagnosis Center,Cerebral Palsy Diagnosis Center,Cerebral Palsy Diagnosis Near Me
Cervical Lymphadenopathy Differential Diagnosis,Cervical Lymphadenopathy Differential Diagnosis Cost,Cervical Lymphadenopathy Differential Diagnosis Center,Cervical Lymphadenopathy Differential Diagnosis Center,Cervical Lymphadenopathy Differential Diagnosis Near Me
Cfs Diagnosis,Cfs Diagnosis Cost,Cfs Diagnosis Center,Cfs Diagnosis Center,Cfs Diagnosis Near Me
Chest Pain Diagnosis,Chest Pain Diagnosis Cost,Chest Pain Diagnosis Center,Chest Pain Diagnosis Center,Chest Pain Diagnosis Near Me
Chest Pain Differential Diagnosis,Chest Pain Differential Diagnosis Cost,Chest Pain Differential Diagnosis Center,Chest Pain Differential Diagnosis Center,Chest Pain Differential Diagnosis Near Me
Chf Diagnosis,Chf Diagnosis Cost,Chf Diagnosis Center,Chf Diagnosis Center,Chf Diagnosis Near Me
Chf Nursing Diagnosis,Chf Nursing Diagnosis Cost,Chf Nursing Diagnosis Center,Chf Nursing Diagnosis Center,Chf Nursing Diagnosis Near Me
Chiari Malformation Diagnosis,Chiari Malformation Diagnosis Cost,Chiari Malformation Diagnosis Center,Chiari Malformation Diagnosis Center,Chiari Malformation Diagnosis Near Me
Chickenpox Diagnosis,Chickenpox Diagnosis Cost,Chickenpox Diagnosis Center,Chickenpox Diagnosis Center,Chickenpox Diagnosis Near Me
Chikungunya Diagnosis,Chikungunya Diagnosis Cost,Chikungunya Diagnosis Center,Chikungunya Diagnosis Center,Chikungunya Diagnosis Near Me
Cholangitis Diagnosis,Cholangitis Diagnosis Cost,Cholangitis Diagnosis Center,Cholangitis Diagnosis Center,Cholangitis Diagnosis Near Me
Cholecystitis Diagnosis,Cholecystitis Diagnosis Cost,Cholecystitis Diagnosis Center,Cholecystitis Diagnosis Center,Cholecystitis Diagnosis Near Me
Cholecystitis Differential Diagnosis,Cholecystitis Differential Diagnosis Cost,Cholecystitis Differential Diagnosis Center,Cholecystitis Differential Diagnosis Center,Cholecystitis Differential Diagnosis Near Me
Cholelithiasis Diagnosis,Cholelithiasis Diagnosis Cost,Cholelithiasis Diagnosis Center,Cholelithiasis Diagnosis Center,Cholelithiasis Diagnosis Near Me
Cholestasis Diagnosis,Cholestasis Diagnosis Cost,Cholestasis Diagnosis Center,Cholestasis Diagnosis Center,Cholestasis Diagnosis Near Me
Christina Applegate Diagnosis,Christina Applegate Diagnosis Cost,Christina Applegate Diagnosis Center,Christina Applegate Diagnosis Center,Christina Applegate Diagnosis Near Me
Christina Applegate Ms Diagnosis,Christina Applegate Ms Diagnosis Cost,Christina Applegate Ms Diagnosis Center,Christina Applegate Ms Diagnosis Center,Christina Applegate Ms Diagnosis Near Me
Chronic Bronchitis Diagnosis,Chronic Bronchitis Diagnosis Cost,Chronic Bronchitis Diagnosis Center,Chronic Bronchitis Diagnosis Center,Chronic Bronchitis Diagnosis Near Me
Chronic Cough Differential Diagnosis,Chronic Cough Differential Diagnosis Cost,Chronic Cough Differential Diagnosis Center,Chronic Cough Differential Diagnosis Center,Chronic Cough Differential Diagnosis Near Me
Chronic Fatigue Syndrome Diagnosis,Chronic Fatigue Syndrome Diagnosis Cost,Chronic Fatigue Syndrome Diagnosis Center,Chronic Fatigue Syndrome Diagnosis Center,Chronic Fatigue Syndrome Diagnosis Near Me
Chronic Kidney Disease Diagnosis,Chronic Kidney Disease Diagnosis Cost,Chronic Kidney Disease Diagnosis Center,Chronic Kidney Disease Diagnosis Center,Chronic Kidney Disease Diagnosis Near Me
Chronic Lymphocytic Leukemia Diagnosis,Chronic Lymphocytic Leukemia Diagnosis Cost,Chronic Lymphocytic Leukemia Diagnosis Center,Chronic Lymphocytic Leukemia Diagnosis Center,Chronic Lymphocytic Leukemia Diagnosis Near Me
Chronic Myeloid Leukemia Diagnosis,Chronic Myeloid Leukemia Diagnosis Cost,Chronic Myeloid Leukemia Diagnosis Center,Chronic Myeloid Leukemia Diagnosis Center,Chronic Myeloid Leukemia Diagnosis Near Me
Chronic Pancreatitis Diagnosis,Chronic Pancreatitis Diagnosis Cost,Chronic Pancreatitis Diagnosis Center,Chronic Pancreatitis Diagnosis Center,Chronic Pancreatitis Diagnosis Near Me
Chylothorax Diagnosis,Chylothorax Diagnosis Cost,Chylothorax Diagnosis Center,Chylothorax Diagnosis Center,Chylothorax Diagnosis Near Me
Cidp Diagnosis,Cidp Diagnosis Cost,Cidp Diagnosis Center,Cidp Diagnosis Center,Cidp Diagnosis Near Me
Cirrhosis Diagnosis,Cirrhosis Diagnosis Cost,Cirrhosis Diagnosis Center,Cirrhosis Diagnosis Center,Cirrhosis Diagnosis Near Me
Ckd Diagnosis,Ckd Diagnosis Cost,Ckd Diagnosis Center,Ckd Diagnosis Center,Ckd Diagnosis Near Me
Clinical Diagnosis,Clinical Diagnosis Cost,Clinical Diagnosis Center,Clinical Diagnosis Center,Clinical Diagnosis Near Me
Cll Diagnosis,Cll Diagnosis Cost,Cll Diagnosis Center,Cll Diagnosis Center,Cll Diagnosis Near Me
Cml Diagnosis,Cml Diagnosis Cost,Cml Diagnosis Center,Cml Diagnosis Center,Cml Diagnosis Near Me
Cmv Diagnosis,Cmv Diagnosis Cost,Cmv Diagnosis Center,Cmv Diagnosis Center,Cmv Diagnosis Near Me
Colitis Diagnosis,Colitis Diagnosis Cost,Colitis Diagnosis Center,Colitis Diagnosis Center,Colitis Diagnosis Near Me
Colon Cancer Diagnosis,Colon Cancer Diagnosis Cost,Colon Cancer Diagnosis Center,Colon Cancer Diagnosis Center,Colon Cancer Diagnosis Near Me
Colorectal Cancer Diagnosis,Colorectal Cancer Diagnosis Cost,Colorectal Cancer Diagnosis Center,Colorectal Cancer Diagnosis Center,Colorectal Cancer Diagnosis Near Me
Comorbid Diagnosis,Comorbid Diagnosis Cost,Comorbid Diagnosis Center,Comorbid Diagnosis Center,Comorbid Diagnosis Near Me
Compartment Syndrome Diagnosis,Compartment Syndrome Diagnosis Cost,Compartment Syndrome Diagnosis Center,Compartment Syndrome Diagnosis Center,Compartment Syndrome Diagnosis Near Me
Concussion Diagnosis,Concussion Diagnosis Cost,Concussion Diagnosis Center,Concussion Diagnosis Center,Concussion Diagnosis Near Me
Congenital Adrenal Hyperplasia Diagnosis,Congenital Adrenal Hyperplasia Diagnosis Cost,Congenital Adrenal Hyperplasia Diagnosis Center,Congenital Adrenal Hyperplasia Diagnosis Center,Congenital Adrenal Hyperplasia Diagnosis Near Me
Congestive Heart Failure Diagnosis,Congestive Heart Failure Diagnosis Cost,Congestive Heart Failure Diagnosis Center,Congestive Heart Failure Diagnosis Center,Congestive Heart Failure Diagnosis Near Me
Congestive Heart Failure Nursing Diagnosis,Congestive Heart Failure Nursing Diagnosis Cost,Congestive Heart Failure Nursing Diagnosis Center,Congestive Heart Failure Nursing Diagnosis Center,Congestive Heart Failure Nursing Diagnosis Near Me
Constipation Diagnosis,Constipation Diagnosis Cost,Constipation Diagnosis Center,Constipation Diagnosis Center,Constipation Diagnosis Near Me
Constipation Differential Diagnosis,Constipation Differential Diagnosis Cost,Constipation Differential Diagnosis Center,Constipation Differential Diagnosis Center,Constipation Differential Diagnosis Near Me
Copd Diagnosis,Copd Diagnosis Cost,Copd Diagnosis Center,Copd Diagnosis Center,Copd Diagnosis Near Me
Copd Differential Diagnosis,Copd Differential Diagnosis Cost,Copd Differential Diagnosis Center,Copd Differential Diagnosis Center,Copd Differential Diagnosis Near Me
Copd Nursing Diagnosis,Copd Nursing Diagnosis Cost,Copd Nursing Diagnosis Center,Copd Nursing Diagnosis Center,Copd Nursing Diagnosis Near Me
Coronary Artery Disease Diagnosis,Coronary Artery Disease Diagnosis Cost,Coronary Artery Disease Diagnosis Center,Coronary Artery Disease Diagnosis Center,Coronary Artery Disease Diagnosis Near Me
Coronary Artery Disease Nursing Diagnosis,Coronary Artery Disease Nursing Diagnosis Cost,Coronary Artery Disease Nursing Diagnosis Center,Coronary Artery Disease Nursing Diagnosis Center,Coronary Artery Disease Nursing Diagnosis Near Me
Costochondritis Diagnosis,Costochondritis Diagnosis Cost,Costochondritis Diagnosis Center,Costochondritis Diagnosis Center,Costochondritis Diagnosis Near Me
Cough Differential Diagnosis,Cough Differential Diagnosis Cost,Cough Differential Diagnosis Center,Cough Differential Diagnosis Center,Cough Differential Diagnosis Near Me
Crmo Diagnosis,Crmo Diagnosis Cost,Crmo Diagnosis Center,Crmo Diagnosis Center,Crmo Diagnosis Near Me
Crohn'S Diagnosis,Crohn'S Diagnosis Cost,Crohn'S Diagnosis Center,Crohn'S Diagnosis Center,Crohn'S Diagnosis Near Me
Crohn'S Disease Diagnosis,Crohn'S Disease Diagnosis Cost,Crohn'S Disease Diagnosis Center,Crohn'S Disease Diagnosis Center,Crohn'S Disease Diagnosis Near Me
Croup Diagnosis,Croup Diagnosis Cost,Croup Diagnosis Center,Croup Diagnosis Center,Croup Diagnosis Near Me
Crps Diagnosis,Crps Diagnosis Cost,Crps Diagnosis Center,Crps Diagnosis Center,Crps Diagnosis Near Me
Crs Diagnosis,Crs Diagnosis Cost,Crs Diagnosis Center,Crs Diagnosis Center,Crs Diagnosis Near Me
Cte Diagnosis,Cte Diagnosis Cost,Cte Diagnosis Center,Cte Diagnosis Center,Cte Diagnosis Near Me
Cteph Diagnosis,Cteph Diagnosis Cost,Cteph Diagnosis Center,Cteph Diagnosis Center,Cteph Diagnosis Near Me
Cva Diagnosis,Cva Diagnosis Cost,Cva Diagnosis Center,Cva Diagnosis Center,Cva Diagnosis Near Me
Cvid Diagnosis,Cvid Diagnosis Cost,Cvid Diagnosis Center,Cvid Diagnosis Center,Cvid Diagnosis Near Me
Cvs Diagnosis,Cvs Diagnosis Cost,Cvs Diagnosis Center,Cvs Diagnosis Center,Cvs Diagnosis Near Me
Cystitis Diagnosis,Cystitis Diagnosis Cost,Cystitis Diagnosis Center,Cystitis Diagnosis Center,Cystitis Diagnosis Near Me
Cytokine Storm Diagnosis,Cytokine Storm Diagnosis Cost,Cytokine Storm Diagnosis Center,Cytokine Storm Diagnosis Center,Cytokine Storm Diagnosis Near Me
Cytomegalovirus Diagnosis,Cytomegalovirus Diagnosis Cost,Cytomegalovirus Diagnosis Center,Cytomegalovirus Diagnosis Center,Cytomegalovirus Diagnosis Near Me
Ddd Diagnosis,Ddd Diagnosis Cost,Ddd Diagnosis Center,Ddd Diagnosis Center,Ddd Diagnosis Near Me
Deep Vein Thrombosis Diagnosis,Deep Vein Thrombosis Diagnosis Cost,Deep Vein Thrombosis Diagnosis Center,Deep Vein Thrombosis Diagnosis Center,Deep Vein Thrombosis Diagnosis Near Me
