name,cost,center,process,nearme
Peptic Ulcer Diagnosis,Peptic Ulcer Diagnosis Cost,Peptic Ulcer Diagnosis Center,Peptic Ulcer Diagnosis Center,Peptic Ulcer Diagnosis Near Me
Pericardial Effusion Diagnosis,Pericardial Effusion Diagnosis Cost,Pericardial Effusion Diagnosis Center,Pericardial Effusion Diagnosis Center,Pericardial Effusion Diagnosis Near Me
Pericarditis Diagnosis,Pericarditis Diagnosis Cost,Pericarditis Diagnosis Center,Pericarditis Diagnosis Center,Pericarditis Diagnosis Near Me
Periorbital Edema Differential Diagnosis,Periorbital Edema Differential Diagnosis Cost,Periorbital Edema Differential Diagnosis Center,Periorbital Edema Differential Diagnosis Center,Periorbital Edema Differential Diagnosis Near Me
Peripheral Artery Disease Diagnosis,Peripheral Artery Disease Diagnosis Cost,Peripheral Artery Disease Diagnosis Center,Peripheral Artery Disease Diagnosis Center,Peripheral Artery Disease Diagnosis Near Me
Peripheral Neuropathy Diagnosis,Peripheral Neuropathy Diagnosis Cost,Peripheral Neuropathy Diagnosis Center,Peripheral Neuropathy Diagnosis Center,Peripheral Neuropathy Diagnosis Near Me
Peritonitis Diagnosis,Peritonitis Diagnosis Cost,Peritonitis Diagnosis Center,Peritonitis Diagnosis Center,Peritonitis Diagnosis Near Me
Pernicious Anemia Diagnosis,Pernicious Anemia Diagnosis Cost,Pernicious Anemia Diagnosis Center,Pernicious Anemia Diagnosis Center,Pernicious Anemia Diagnosis Near Me
Pertussis Diagnosis,Pertussis Diagnosis Cost,Pertussis Diagnosis Center,Pertussis Diagnosis Center,Pertussis Diagnosis Near Me
Pheochromocytoma Diagnosis,Pheochromocytoma Diagnosis Cost,Pheochromocytoma Diagnosis Center,Pheochromocytoma Diagnosis Center,Pheochromocytoma Diagnosis Near Me
Physical Diagnosis,Physical Diagnosis Cost,Physical Diagnosis Center,Physical Diagnosis Center,Physical Diagnosis Near Me
Pid Diagnosis,Pid Diagnosis Cost,Pid Diagnosis Center,Pid Diagnosis Center,Pid Diagnosis Near Me
Piriformis Syndrome Diagnosis,Piriformis Syndrome Diagnosis Cost,Piriformis Syndrome Diagnosis Center,Piriformis Syndrome Diagnosis Center,Piriformis Syndrome Diagnosis Near Me
Placenta Previa Diagnosis,Placenta Previa Diagnosis Cost,Placenta Previa Diagnosis Center,Placenta Previa Diagnosis Center,Placenta Previa Diagnosis Near Me
Plantar Fasciitis Diagnosis,Plantar Fasciitis Diagnosis Cost,Plantar Fasciitis Diagnosis Center,Plantar Fasciitis Diagnosis Center,Plantar Fasciitis Diagnosis Near Me
Pleural Effusion Diagnosis,Pleural Effusion Diagnosis Cost,Pleural Effusion Diagnosis Center,Pleural Effusion Diagnosis Center,Pleural Effusion Diagnosis Near Me
Pleurisy Diagnosis,Pleurisy Diagnosis Cost,Pleurisy Diagnosis Center,Pleurisy Diagnosis Center,Pleurisy Diagnosis Near Me
Pmdd Diagnosis,Pmdd Diagnosis Cost,Pmdd Diagnosis Center,Pmdd Diagnosis Center,Pmdd Diagnosis Near Me
Pmr Diagnosis,Pmr Diagnosis Cost,Pmr Diagnosis Center,Pmr Diagnosis Center,Pmr Diagnosis Near Me
Pneumonia Diagnosis,Pneumonia Diagnosis Cost,Pneumonia Diagnosis Center,Pneumonia Diagnosis Center,Pneumonia Diagnosis Near Me
Pneumothorax Diagnosis,Pneumothorax Diagnosis Cost,Pneumothorax Diagnosis Center,Pneumothorax Diagnosis Center,Pneumothorax Diagnosis Near Me
Pnh Diagnosis,Pnh Diagnosis Cost,Pnh Diagnosis Center,Pnh Diagnosis Center,Pnh Diagnosis Near Me
Polycystic Kidney Disease Diagnosis,Polycystic Kidney Disease Diagnosis Cost,Polycystic Kidney Disease Diagnosis Center,Polycystic Kidney Disease Diagnosis Center,Polycystic Kidney Disease Diagnosis Near Me
Polycythemia Diagnosis,Polycythemia Diagnosis Cost,Polycythemia Diagnosis Center,Polycythemia Diagnosis Center,Polycythemia Diagnosis Near Me
Polycythemia Vera Diagnosis,Polycythemia Vera Diagnosis Cost,Polycythemia Vera Diagnosis Center,Polycythemia Vera Diagnosis Center,Polycythemia Vera Diagnosis Near Me
Polymyalgia Rheumatica Diagnosis,Polymyalgia Rheumatica Diagnosis Cost,Polymyalgia Rheumatica Diagnosis Center,Polymyalgia Rheumatica Diagnosis Center,Polymyalgia Rheumatica Diagnosis Near Me
Polymyositis Diagnosis,Polymyositis Diagnosis Cost,Polymyositis Diagnosis Center,Polymyositis Diagnosis Center,Polymyositis Diagnosis Near Me
Polyuria Differential Diagnosis,Polyuria Differential Diagnosis Cost,Polyuria Differential Diagnosis Center,Polyuria Differential Diagnosis Center,Polyuria Differential Diagnosis Near Me
Porphyria Diagnosis,Porphyria Diagnosis Cost,Porphyria Diagnosis Center,Porphyria Diagnosis Center,Porphyria Diagnosis Near Me
Portal Hypertension Diagnosis,Portal Hypertension Diagnosis Cost,Portal Hypertension Diagnosis Center,Portal Hypertension Diagnosis Center,Portal Hypertension Diagnosis Near Me
Pots Diagnosis,Pots Diagnosis Cost,Pots Diagnosis Center,Pots Diagnosis Center,Pots Diagnosis Near Me
Pots Syndrome Diagnosis,Pots Syndrome Diagnosis Cost,Pots Syndrome Diagnosis Center,Pots Syndrome Diagnosis Center,Pots Syndrome Diagnosis Near Me
Pppd Diagnosis,Pppd Diagnosis Cost,Pppd Diagnosis Center,Pppd Diagnosis Center,Pppd Diagnosis Near Me
Precocious Puberty Diagnosis,Precocious Puberty Diagnosis Cost,Precocious Puberty Diagnosis Center,Precocious Puberty Diagnosis Center,Precocious Puberty Diagnosis Near Me
Prediabetes Diagnosis,Prediabetes Diagnosis Cost,Prediabetes Diagnosis Center,Prediabetes Diagnosis Center,Prediabetes Diagnosis Near Me
Preeclampsia Diagnosis,Preeclampsia Diagnosis Cost,Preeclampsia Diagnosis Center,Preeclampsia Diagnosis Center,Preeclampsia Diagnosis Near Me
Preliminary Diagnosis,Preliminary Diagnosis Cost,Preliminary Diagnosis Center,Preliminary Diagnosis Center,Preliminary Diagnosis Near Me
Presumptive Diagnosis,Presumptive Diagnosis Cost,Presumptive Diagnosis Center,Presumptive Diagnosis Center,Presumptive Diagnosis Near Me
Primary Biliary Cirrhosis Diagnosis,Primary Biliary Cirrhosis Diagnosis Cost,Primary Biliary Cirrhosis Diagnosis Center,Primary Biliary Cirrhosis Diagnosis Center,Primary Biliary Cirrhosis Diagnosis Near Me
Primary Diagnosis,Primary Diagnosis Cost,Primary Diagnosis Center,Primary Diagnosis Center,Primary Diagnosis Near Me
Principal Diagnosis,Principal Diagnosis Cost,Principal Diagnosis Center,Principal Diagnosis Center,Principal Diagnosis Near Me
Prognosis Diagnosis,Prognosis Diagnosis Cost,Prognosis Diagnosis Center,Prognosis Diagnosis Center,Prognosis Diagnosis Near Me
Provisional Diagnosis,Provisional Diagnosis Cost,Provisional Diagnosis Center,Provisional Diagnosis Center,Provisional Diagnosis Near Me
Psc Diagnosis,Psc Diagnosis Cost,Psc Diagnosis Center,Psc Diagnosis Center,Psc Diagnosis Near Me
Pseudotumor Cerebri Diagnosis,Pseudotumor Cerebri Diagnosis Cost,Pseudotumor Cerebri Diagnosis Center,Pseudotumor Cerebri Diagnosis Center,Pseudotumor Cerebri Diagnosis Near Me
Psoriasis Diagnosis,Psoriasis Diagnosis Cost,Psoriasis Diagnosis Center,Psoriasis Diagnosis Center,Psoriasis Diagnosis Near Me
Psoriasis Differential Diagnosis,Psoriasis Differential Diagnosis Cost,Psoriasis Differential Diagnosis Center,Psoriasis Differential Diagnosis Center,Psoriasis Differential Diagnosis Near Me
Psoriatic Arthritis Diagnosis,Psoriatic Arthritis Diagnosis Cost,Psoriatic Arthritis Diagnosis Center,Psoriatic Arthritis Diagnosis Center,Psoriatic Arthritis Diagnosis Near Me
Psp Diagnosis,Psp Diagnosis Cost,Psp Diagnosis Center,Psp Diagnosis Center,Psp Diagnosis Near Me
Psychosis Diagnosis,Psychosis Diagnosis Cost,Psychosis Diagnosis Center,Psychosis Diagnosis Center,Psychosis Diagnosis Near Me
Pud Diagnosis,Pud Diagnosis Cost,Pud Diagnosis Center,Pud Diagnosis Center,Pud Diagnosis Near Me
Pulmonary Edema Diagnosis,Pulmonary Edema Diagnosis Cost,Pulmonary Edema Diagnosis Center,Pulmonary Edema Diagnosis Center,Pulmonary Edema Diagnosis Near Me
Pulmonary Embolism Diagnosis,Pulmonary Embolism Diagnosis Cost,Pulmonary Embolism Diagnosis Center,Pulmonary Embolism Diagnosis Center,Pulmonary Embolism Diagnosis Near Me
Pulmonary Fibrosis Diagnosis,Pulmonary Fibrosis Diagnosis Cost,Pulmonary Fibrosis Diagnosis Center,Pulmonary Fibrosis Diagnosis Center,Pulmonary Fibrosis Diagnosis Near Me
Pulmonary Hypertension Diagnosis,Pulmonary Hypertension Diagnosis Cost,Pulmonary Hypertension Diagnosis Center,Pulmonary Hypertension Diagnosis Center,Pulmonary Hypertension Diagnosis Near Me
Pulmonary Tuberculosis Diagnosis,Pulmonary Tuberculosis Diagnosis Cost,Pulmonary Tuberculosis Diagnosis Center,Pulmonary Tuberculosis Diagnosis Center,Pulmonary Tuberculosis Diagnosis Near Me
Pyelonephritis Diagnosis,Pyelonephritis Diagnosis Cost,Pyelonephritis Diagnosis Center,Pyelonephritis Diagnosis Center,Pyelonephritis Diagnosis Near Me
Pyloric Stenosis Diagnosis,Pyloric Stenosis Diagnosis Cost,Pyloric Stenosis Diagnosis Center,Pyloric Stenosis Diagnosis Center,Pyloric Stenosis Diagnosis Near Me
Ra Diagnosis,Ra Diagnosis Cost,Ra Diagnosis Center,Ra Diagnosis Center,Ra Diagnosis Near Me
Rash Diagnosis,Rash Diagnosis Cost,Rash Diagnosis Center,Rash Diagnosis Center,Rash Diagnosis Near Me
Rash Differential Diagnosis,Rash Differential Diagnosis Cost,Rash Differential Diagnosis Center,Rash Differential Diagnosis Center,Rash Differential Diagnosis Near Me
Red Eye Differential Diagnosis,Red Eye Differential Diagnosis Cost,Red Eye Differential Diagnosis Center,Red Eye Differential Diagnosis Center,Red Eye Differential Diagnosis Near Me
Renal Tubular Acidosis Diagnosis,Renal Tubular Acidosis Diagnosis Cost,Renal Tubular Acidosis Diagnosis Center,Renal Tubular Acidosis Diagnosis Center,Renal Tubular Acidosis Diagnosis Near Me
Retinal Detachment Diagnosis,Retinal Detachment Diagnosis Cost,Retinal Detachment Diagnosis Center,Retinal Detachment Diagnosis Center,Retinal Detachment Diagnosis Near Me
Rhabdomyolysis Diagnosis,Rhabdomyolysis Diagnosis Cost,Rhabdomyolysis Diagnosis Center,Rhabdomyolysis Diagnosis Center,Rhabdomyolysis Diagnosis Near Me
Rheumatic Fever Diagnosis,Rheumatic Fever Diagnosis Cost,Rheumatic Fever Diagnosis Center,Rheumatic Fever Diagnosis Center,Rheumatic Fever Diagnosis Near Me
Rheumatic Heart Disease Diagnosis,Rheumatic Heart Disease Diagnosis Cost,Rheumatic Heart Disease Diagnosis Center,Rheumatic Heart Disease Diagnosis Center,Rheumatic Heart Disease Diagnosis Near Me
Rheumatoid Arthritis Diagnosis,Rheumatoid Arthritis Diagnosis Cost,Rheumatoid Arthritis Diagnosis Center,Rheumatoid Arthritis Diagnosis Center,Rheumatoid Arthritis Diagnosis Near Me
Rheumatoid Arthritis Differential Diagnosis,Rheumatoid Arthritis Differential Diagnosis Cost,Rheumatoid Arthritis Differential Diagnosis Center,Rheumatoid Arthritis Differential Diagnosis Center,Rheumatoid Arthritis Differential Diagnosis Near Me
Rickets Diagnosis,Rickets Diagnosis Cost,Rickets Diagnosis Center,Rickets Diagnosis Center,Rickets Diagnosis Near Me
Right Lower Quadrant Pain Differential Diagnosis,Right Lower Quadrant Pain Differential Diagnosis Cost,Right Lower Quadrant Pain Differential Diagnosis Center,Right Lower Quadrant Pain Differential Diagnosis Center,Right Lower Quadrant Pain Differential Diagnosis Near Me
Right Upper Quadrant Pain Differential Diagnosis,Right Upper Quadrant Pain Differential Diagnosis Cost,Right Upper Quadrant Pain Differential Diagnosis Center,Right Upper Quadrant Pain Differential Diagnosis Center,Right Upper Quadrant Pain Differential Diagnosis Near Me
Ringworm Diagnosis,Ringworm Diagnosis Cost,Ringworm Diagnosis Center,Ringworm Diagnosis Center,Ringworm Diagnosis Near Me
Roseola Diagnosis,Roseola Diagnosis Cost,Roseola Diagnosis Center,Roseola Diagnosis Center,Roseola Diagnosis Near Me
Rsd Diagnosis,Rsd Diagnosis Cost,Rsd Diagnosis Center,Rsd Diagnosis Center,Rsd Diagnosis Near Me
Rta Diagnosis,Rta Diagnosis Cost,Rta Diagnosis Center,Rta Diagnosis Center,Rta Diagnosis Near Me
Sad Diagnosis,Sad Diagnosis Cost,Sad Diagnosis Center,Sad Diagnosis Center,Sad Diagnosis Near Me
Salmonella Diagnosis,Salmonella Diagnosis Cost,Salmonella Diagnosis Center,Salmonella Diagnosis Center,Salmonella Diagnosis Near Me
Sarcoidosis Diagnosis,Sarcoidosis Diagnosis Cost,Sarcoidosis Diagnosis Center,Sarcoidosis Diagnosis Center,Sarcoidosis Diagnosis Near Me
Sarcopenia Diagnosis,Sarcopenia Diagnosis Cost,Sarcopenia Diagnosis Center,Sarcopenia Diagnosis Center,Sarcopenia Diagnosis Near Me
Sbp Diagnosis,Sbp Diagnosis Cost,Sbp Diagnosis Center,Sbp Diagnosis Center,Sbp Diagnosis Near Me
Scabies Differential Diagnosis,Scabies Differential Diagnosis Cost,Scabies Differential Diagnosis Center,Scabies Differential Diagnosis Center,Scabies Differential Diagnosis Near Me
Schizophrenia Diagnosis,Schizophrenia Diagnosis Cost,Schizophrenia Diagnosis Center,Schizophrenia Diagnosis Center,Schizophrenia Diagnosis Near Me
Schizophrenia Differential Diagnosis,Schizophrenia Differential Diagnosis Cost,Schizophrenia Differential Diagnosis Center,Schizophrenia Differential Diagnosis Center,Schizophrenia Differential Diagnosis Near Me
Schizophrenia Nursing Diagnosis,Schizophrenia Nursing Diagnosis Cost,Schizophrenia Nursing Diagnosis Center,Schizophrenia Nursing Diagnosis Center,Schizophrenia Nursing Diagnosis Near Me
Sciatica Diagnosis,Sciatica Diagnosis Cost,Sciatica Diagnosis Center,Sciatica Diagnosis Center,Sciatica Diagnosis Near Me
Sciatica Differential Diagnosis,Sciatica Differential Diagnosis Cost,Sciatica Differential Diagnosis Center,Sciatica Differential Diagnosis Center,Sciatica Differential Diagnosis Near Me
Scid Diagnosis,Scid Diagnosis Cost,Scid Diagnosis Center,Scid Diagnosis Center,Scid Diagnosis Near Me
Scleroderma Diagnosis,Scleroderma Diagnosis Cost,Scleroderma Diagnosis Center,Scleroderma Diagnosis Center,Scleroderma Diagnosis Near Me
Scoliosis Diagnosis,Scoliosis Diagnosis Cost,Scoliosis Diagnosis Center,Scoliosis Diagnosis Center,Scoliosis Diagnosis Near Me
Second Trimester Bleeding Differential Diagnosis,Second Trimester Bleeding Differential Diagnosis Cost,Second Trimester Bleeding Differential Diagnosis Center,Second Trimester Bleeding Differential Diagnosis Center,Second Trimester Bleeding Differential Diagnosis Near Me
Secondary Diagnosis,Secondary Diagnosis Cost,Secondary Diagnosis Center,Secondary Diagnosis Center,Secondary Diagnosis Near Me
Seizure Diagnosis,Seizure Diagnosis Cost,Seizure Diagnosis Center,Seizure Diagnosis Center,Seizure Diagnosis Near Me
Seizure Differential Diagnosis,Seizure Differential Diagnosis Cost,Seizure Differential Diagnosis Center,Seizure Differential Diagnosis Center,Seizure Differential Diagnosis Near Me
Seizure Nursing Diagnosis,Seizure Nursing Diagnosis Cost,Seizure Nursing Diagnosis Center,Seizure Nursing Diagnosis Center,Seizure Nursing Diagnosis Near Me
Self Diagnosis,Self Diagnosis Cost,Self Diagnosis Center,Self Diagnosis Center,Self Diagnosis Near Me
Selma Blair Ms Diagnosis,Selma Blair Ms Diagnosis Cost,Selma Blair Ms Diagnosis Center,Selma Blair Ms Diagnosis Center,Selma Blair Ms Diagnosis Near Me
Sepsis Diagnosis,Sepsis Diagnosis Cost,Sepsis Diagnosis Center,Sepsis Diagnosis Center,Sepsis Diagnosis Near Me
Septic Arthritis Diagnosis,Septic Arthritis Diagnosis Cost,Septic Arthritis Diagnosis Center,Septic Arthritis Diagnosis Center,Septic Arthritis Diagnosis Near Me
Septic Shock Diagnosis,Septic Shock Diagnosis Cost,Septic Shock Diagnosis Center,Septic Shock Diagnosis Center,Septic Shock Diagnosis Near Me
Shingles Diagnosis,Shingles Diagnosis Cost,Shingles Diagnosis Center,Shingles Diagnosis Center,Shingles Diagnosis Near Me
Shingles Differential Diagnosis,Shingles Differential Diagnosis Cost,Shingles Differential Diagnosis Center,Shingles Differential Diagnosis Center,Shingles Differential Diagnosis Near Me
Shortness Of Breath Differential Diagnosis,Shortness Of Breath Differential Diagnosis Cost,Shortness Of Breath Differential Diagnosis Center,Shortness Of Breath Differential Diagnosis Center,Shortness Of Breath Differential Diagnosis Near Me
Shoulder Injury Diagnosis,Shoulder Injury Diagnosis Cost,Shoulder Injury Diagnosis Center,Shoulder Injury Diagnosis Center,Shoulder Injury Diagnosis Near Me
Shoulder Pain Diagnosis,Shoulder Pain Diagnosis Cost,Shoulder Pain Diagnosis Center,Shoulder Pain Diagnosis Center,Shoulder Pain Diagnosis Near Me
Shoulder Pain Differential Diagnosis,Shoulder Pain Differential Diagnosis Cost,Shoulder Pain Differential Diagnosis Center,Shoulder Pain Differential Diagnosis Center,Shoulder Pain Differential Diagnosis Near Me
Siadh Diagnosis,Siadh Diagnosis Cost,Siadh Diagnosis Center,Siadh Diagnosis Center,Siadh Diagnosis Near Me
Sibo Diagnosis,Sibo Diagnosis Cost,Sibo Diagnosis Center,Sibo Diagnosis Center,Sibo Diagnosis Near Me
Sickle Cell Anemia Diagnosis,Sickle Cell Anemia Diagnosis Cost,Sickle Cell Anemia Diagnosis Center,Sickle Cell Anemia Diagnosis Center,Sickle Cell Anemia Diagnosis Near Me
Sickle Cell Anemia Nursing Diagnosis,Sickle Cell Anemia Nursing Diagnosis Cost,Sickle Cell Anemia Nursing Diagnosis Center,Sickle Cell Anemia Nursing Diagnosis Center,Sickle Cell Anemia Nursing Diagnosis Near Me
Sickle Cell Diagnosis,Sickle Cell Diagnosis Cost,Sickle Cell Diagnosis Center,Sickle Cell Diagnosis Center,Sickle Cell Diagnosis Near Me
Sjogren'S Syndrome Diagnosis,Sjogren'S Syndrome Diagnosis Cost,Sjogren'S Syndrome Diagnosis Center,Sjogren'S Syndrome Diagnosis Center,Sjogren'S Syndrome Diagnosis Near Me
Skin Diagnosis,Skin Diagnosis Cost,Skin Diagnosis Center,Skin Diagnosis Center,Skin Diagnosis Near Me
Sle Diagnosis,Sle Diagnosis Cost,Sle Diagnosis Center,Sle Diagnosis Center,Sle Diagnosis Near Me
Sle Differential Diagnosis,Sle Differential Diagnosis Cost,Sle Differential Diagnosis Center,Sle Differential Diagnosis Center,Sle Differential Diagnosis Near Me
Sleep Apnea Diagnosis,Sleep Apnea Diagnosis Cost,Sleep Apnea Diagnosis Center,Sleep Apnea Diagnosis Center,Sleep Apnea Diagnosis Near Me
Sma Syndrome Diagnosis,Sma Syndrome Diagnosis Cost,Sma Syndrome Diagnosis Center,Sma Syndrome Diagnosis Center,Sma Syndrome Diagnosis Near Me
Soft Tissue Mass Differential Diagnosis,Soft Tissue Mass Differential Diagnosis Cost,Soft Tissue Mass Differential Diagnosis Center,Soft Tissue Mass Differential Diagnosis Center,Soft Tissue Mass Differential Diagnosis Near Me
Sore Throat Differential Diagnosis,Sore Throat Differential Diagnosis Cost,Sore Throat Differential Diagnosis Center,Sore Throat Differential Diagnosis Center,Sore Throat Differential Diagnosis Near Me
Spina Bifida Diagnosis,Spina Bifida Diagnosis Cost,Spina Bifida Diagnosis Center,Spina Bifida Diagnosis Center,Spina Bifida Diagnosis Near Me
Spinal Stenosis Diagnosis,Spinal Stenosis Diagnosis Cost,Spinal Stenosis Diagnosis Center,Spinal Stenosis Diagnosis Center,Spinal Stenosis Diagnosis Near Me
Splenomegaly Differential Diagnosis,Splenomegaly Differential Diagnosis Cost,Splenomegaly Differential Diagnosis Center,Splenomegaly Differential Diagnosis Center,Splenomegaly Differential Diagnosis Near Me
Spontaneous Bacterial Peritonitis Diagnosis,Spontaneous Bacterial Peritonitis Diagnosis Cost,Spontaneous Bacterial Peritonitis Diagnosis Center,Spontaneous Bacterial Peritonitis Diagnosis Center,Spontaneous Bacterial Peritonitis Diagnosis Near Me
Spot Diagnosis,Spot Diagnosis Cost,Spot Diagnosis Center,Spot Diagnosis Center,Spot Diagnosis Near Me
Stomach Cancer Diagnosis,Stomach Cancer Diagnosis Cost,Stomach Cancer Diagnosis Center,Stomach Cancer Diagnosis Center,Stomach Cancer Diagnosis Near Me
Stomach Ulcer Diagnosis,Stomach Ulcer Diagnosis Cost,Stomach Ulcer Diagnosis Center,Stomach Ulcer Diagnosis Center,Stomach Ulcer Diagnosis Near Me
Strep Throat Diagnosis,Strep Throat Diagnosis Cost,Strep Throat Diagnosis Center,Strep Throat Diagnosis Center,Strep Throat Diagnosis Near Me
Stroke Diagnosis,Stroke Diagnosis Cost,Stroke Diagnosis Center,Stroke Diagnosis Center,Stroke Diagnosis Near Me
Stroke Differential Diagnosis,Stroke Differential Diagnosis Cost,Stroke Differential Diagnosis Center,Stroke Differential Diagnosis Center,Stroke Differential Diagnosis Near Me
Svt Diagnosis,Svt Diagnosis Cost,Svt Diagnosis Center,Svt Diagnosis Center,Svt Diagnosis Near Me
Symptom Checker Diagnosis,Symptom Checker Diagnosis Cost,Symptom Checker Diagnosis Center,Symptom Checker Diagnosis Center,Symptom Checker Diagnosis Near Me
Symptom Diagnosis,Symptom Diagnosis Cost,Symptom Diagnosis Center,Symptom Diagnosis Center,Symptom Diagnosis Near Me
Symptoms And Diagnosis,Symptoms And Diagnosis Cost,Symptoms And Diagnosis Center,Symptoms And Diagnosis Center,Symptoms And Diagnosis Near Me
Syncope Differential Diagnosis,Syncope Differential Diagnosis Cost,Syncope Differential Diagnosis Center,Syncope Differential Diagnosis Center,Syncope Differential Diagnosis Near Me
Systemic Lupus Erythematosus Diagnosis,Systemic Lupus Erythematosus Diagnosis Cost,Systemic Lupus Erythematosus Diagnosis Center,Systemic Lupus Erythematosus Diagnosis Center,Systemic Lupus Erythematosus Diagnosis Near Me
T1D Diagnosis,T1D Diagnosis Cost,T1D Diagnosis Center,T1D Diagnosis Center,T1D Diagnosis Near Me
Tbi Diagnosis,Tbi Diagnosis Cost,Tbi Diagnosis Center,Tbi Diagnosis Center,Tbi Diagnosis Near Me
Temporal Arteritis Diagnosis,Temporal Arteritis Diagnosis Cost,Temporal Arteritis Diagnosis Center,Temporal Arteritis Diagnosis Center,Temporal Arteritis Diagnosis Near Me
Tennis Elbow Diagnosis,Tennis Elbow Diagnosis Cost,Tennis Elbow Diagnosis Center,Tennis Elbow Diagnosis Center,Tennis Elbow Diagnosis Near Me
Testicle Odor Diagnosis,Testicle Odor Diagnosis Cost,Testicle Odor Diagnosis Center,Testicle Odor Diagnosis Center,Testicle Odor Diagnosis Near Me
Testicular Cancer Diagnosis,Testicular Cancer Diagnosis Cost,Testicular Cancer Diagnosis Center,Testicular Cancer Diagnosis Center,Testicular Cancer Diagnosis Near Me
Tetanus Diagnosis,Tetanus Diagnosis Cost,Tetanus Diagnosis Center,Tetanus Diagnosis Center,Tetanus Diagnosis Near Me
Thalassemia Diagnosis,Thalassemia Diagnosis Cost,Thalassemia Diagnosis Center,Thalassemia Diagnosis Center,Thalassemia Diagnosis Near Me
Thalassemia Trait Diagnosis,Thalassemia Trait Diagnosis Cost,Thalassemia Trait Diagnosis Center,Thalassemia Trait Diagnosis Center,Thalassemia Trait Diagnosis Near Me
Thoracic Outlet Syndrome Diagnosis,Thoracic Outlet Syndrome Diagnosis Cost,Thoracic Outlet Syndrome Diagnosis Center,Thoracic Outlet Syndrome Diagnosis Center,Thoracic Outlet Syndrome Diagnosis Near Me
Throat Cancer Diagnosis,Throat Cancer Diagnosis Cost,Throat Cancer Diagnosis Center,Throat Cancer Diagnosis Center,Throat Cancer Diagnosis Near Me
Thrombocytopenia Differential Diagnosis,Thrombocytopenia Differential Diagnosis Cost,Thrombocytopenia Differential Diagnosis Center,Thrombocytopenia Differential Diagnosis Center,Thrombocytopenia Differential Diagnosis Near Me
Thyroid Cancer Diagnosis,Thyroid Cancer Diagnosis Cost,Thyroid Cancer Diagnosis Center,Thyroid Cancer Diagnosis Center,Thyroid Cancer Diagnosis Near Me
Tia Diagnosis,Tia Diagnosis Cost,Tia Diagnosis Center,Tia Diagnosis Center,Tia Diagnosis Near Me
Tia Stroke Diagnosis,Tia Stroke Diagnosis Cost,Tia Stroke Diagnosis Center,Tia Stroke Diagnosis Center,Tia Stroke Diagnosis Near Me
Tmj Diagnosis,Tmj Diagnosis Cost,Tmj Diagnosis Center,Tmj Diagnosis Center,Tmj Diagnosis Near Me
Toxoplasmosis Diagnosis,Toxoplasmosis Diagnosis Cost,Toxoplasmosis Diagnosis Center,Toxoplasmosis Diagnosis Center,Toxoplasmosis Diagnosis Near Me
Transverse Myelitis Diagnosis,Transverse Myelitis Diagnosis Cost,Transverse Myelitis Diagnosis Center,Transverse Myelitis Diagnosis Center,Transverse Myelitis Diagnosis Near Me
Trichomoniasis Diagnosis,Trichomoniasis Diagnosis Cost,Trichomoniasis Diagnosis Center,Trichomoniasis Diagnosis Center,Trichomoniasis Diagnosis Near Me
Trigeminal Neuralgia Diagnosis,Trigeminal Neuralgia Diagnosis Cost,Trigeminal Neuralgia Diagnosis Center,Trigeminal Neuralgia Diagnosis Center,Trigeminal Neuralgia Diagnosis Near Me
Ttp Diagnosis,Ttp Diagnosis Cost,Ttp Diagnosis Center,Ttp Diagnosis Center,Ttp Diagnosis Near Me
Tuberculosis Diagnosis,Tuberculosis Diagnosis Cost,Tuberculosis Diagnosis Center,Tuberculosis Diagnosis Center,Tuberculosis Diagnosis Near Me
Type 1 Diabetes Diagnosis,Type 1 Diabetes Diagnosis Cost,Type 1 Diabetes Diagnosis Center,Type 1 Diabetes Diagnosis Center,Type 1 Diabetes Diagnosis Near Me
Type 2 Diabetes Diagnosis,Type 2 Diabetes Diagnosis Cost,Type 2 Diabetes Diagnosis Center,Type 2 Diabetes Diagnosis Center,Type 2 Diabetes Diagnosis Near Me
Types Of Diagnosis,Types Of Diagnosis Cost,Types Of Diagnosis Center,Types Of Diagnosis Center,Types Of Diagnosis Near Me
Typhoid Diagnosis,Typhoid Diagnosis Cost,Typhoid Diagnosis Center,Typhoid Diagnosis Center,Typhoid Diagnosis Near Me
Typhoid Fever Diagnosis,Typhoid Fever Diagnosis Cost,Typhoid Fever Diagnosis Center,Typhoid Fever Diagnosis Center,Typhoid Fever Diagnosis Near Me
Uc Diagnosis,Uc Diagnosis Cost,Uc Diagnosis Center,Uc Diagnosis Center,Uc Diagnosis Near Me
Ulcer Diagnosis,Ulcer Diagnosis Cost,Ulcer Diagnosis Center,Ulcer Diagnosis Center,Ulcer Diagnosis Near Me
Ulcerative Colitis Diagnosis,Ulcerative Colitis Diagnosis Cost,Ulcerative Colitis Diagnosis Center,Ulcerative Colitis Diagnosis Center,Ulcerative Colitis Diagnosis Near Me
Unstable Angina Diagnosis,Unstable Angina Diagnosis Cost,Unstable Angina Diagnosis Center,Unstable Angina Diagnosis Center,Unstable Angina Diagnosis Near Me
Unstable Blood Glucose Nursing Diagnosis,Unstable Blood Glucose Nursing Diagnosis Cost,Unstable Blood Glucose Nursing Diagnosis Center,Unstable Blood Glucose Nursing Diagnosis Center,Unstable Blood Glucose Nursing Diagnosis Near Me
Uremia Diagnosis,Uremia Diagnosis Cost,Uremia Diagnosis Center,Uremia Diagnosis Center,Uremia Diagnosis Near Me
Urinary Incontinence Nursing Diagnosis,Urinary Incontinence Nursing Diagnosis Cost,Urinary Incontinence Nursing Diagnosis Center,Urinary Incontinence Nursing Diagnosis Center,Urinary Incontinence Nursing Diagnosis Near Me
Urinary Tract Infection Diagnosis,Urinary Tract Infection Diagnosis Cost,Urinary Tract Infection Diagnosis Center,Urinary Tract Infection Diagnosis Center,Urinary Tract Infection Diagnosis Near Me
