name,cost,center,process,nearme
Definitive Diagnosis,Definitive Diagnosis Cost,Definitive Diagnosis Center,Definitive Diagnosis Center,Definitive Diagnosis Near Me
Delirium Diagnosis,Delirium Diagnosis Cost,Delirium Diagnosis Center,Delirium Diagnosis Center,Delirium Diagnosis Near Me
Delta Diagnosis,Delta Diagnosis Cost,Delta Diagnosis Center,Delta Diagnosis Center,Delta Diagnosis Near Me
Dementia Diagnosis,Dementia Diagnosis Cost,Dementia Diagnosis Center,Dementia Diagnosis Center,Dementia Diagnosis Near Me
Dengue Diagnosis,Dengue Diagnosis Cost,Dengue Diagnosis Center,Dengue Diagnosis Center,Dengue Diagnosis Near Me
Dengue Differential Diagnosis,Dengue Differential Diagnosis Cost,Dengue Differential Diagnosis Center,Dengue Differential Diagnosis Center,Dengue Differential Diagnosis Near Me
Dengue Fever Diagnosis,Dengue Fever Diagnosis Cost,Dengue Fever Diagnosis Center,Dengue Fever Diagnosis Center,Dengue Fever Diagnosis Near Me
Depression Diagnosis,Depression Diagnosis Cost,Depression Diagnosis Center,Depression Diagnosis Center,Depression Diagnosis Near Me
Depression Differential Diagnosis,Depression Differential Diagnosis Cost,Depression Differential Diagnosis Center,Depression Differential Diagnosis Center,Depression Differential Diagnosis Near Me
Dermatomyositis Diagnosis,Dermatomyositis Diagnosis Cost,Dermatomyositis Diagnosis Center,Dermatomyositis Diagnosis Center,Dermatomyositis Diagnosis Near Me
Diabetes Diagnosis,Diabetes Diagnosis Cost,Diabetes Diagnosis Center,Diabetes Diagnosis Center,Diabetes Diagnosis Near Me
Diabetes Insipidus Diagnosis,Diabetes Insipidus Diagnosis Cost,Diabetes Insipidus Diagnosis Center,Diabetes Insipidus Diagnosis Center,Diabetes Insipidus Diagnosis Near Me
Diabetic Ketoacidosis Diagnosis,Diabetic Ketoacidosis Diagnosis Cost,Diabetic Ketoacidosis Diagnosis Center,Diabetic Ketoacidosis Diagnosis Center,Diabetic Ketoacidosis Diagnosis Near Me
Diabetic Nephropathy Diagnosis,Diabetic Nephropathy Diagnosis Cost,Diabetic Nephropathy Diagnosis Center,Diabetic Nephropathy Diagnosis Center,Diabetic Nephropathy Diagnosis Near Me
Diabetic Neuropathy Diagnosis,Diabetic Neuropathy Diagnosis Cost,Diabetic Neuropathy Diagnosis Center,Diabetic Neuropathy Diagnosis Center,Diabetic Neuropathy Diagnosis Near Me
Diabetic Retinopathy Diagnosis,Diabetic Retinopathy Diagnosis Cost,Diabetic Retinopathy Diagnosis Center,Diabetic Retinopathy Diagnosis Center,Diabetic Retinopathy Diagnosis Near Me
Diagnosis And Prognosis,Diagnosis And Prognosis Cost,Diagnosis And Prognosis Center,Diagnosis And Prognosis Center,Diagnosis And Prognosis Near Me
Diagnosis Of Alzheimer'S Disease,Diagnosis Of Alzheimer'S Disease Cost,Diagnosis Of Alzheimer'S Disease Center,Diagnosis Of Alzheimer'S Disease Center,Diagnosis Of Alzheimer'S Disease Near Me
Diagnosis Of Diabetes Mellitus,Diagnosis Of Diabetes Mellitus Cost,Diagnosis Of Diabetes Mellitus Center,Diagnosis Of Diabetes Mellitus Center,Diagnosis Of Diabetes Mellitus Near Me
Diarrhea Diagnosis,Diarrhea Diagnosis Cost,Diarrhea Diagnosis Center,Diarrhea Diagnosis Center,Diarrhea Diagnosis Near Me
Diarrhea Differential Diagnosis,Diarrhea Differential Diagnosis Cost,Diarrhea Differential Diagnosis Center,Diarrhea Differential Diagnosis Center,Diarrhea Differential Diagnosis Near Me
Dic Diagnosis,Dic Diagnosis Cost,Dic Diagnosis Center,Dic Diagnosis Center,Dic Diagnosis Near Me
Differential Diagnosis,Differential Diagnosis Cost,Differential Diagnosis Center,Differential Diagnosis Center,Differential Diagnosis Near Me
Differential Diagnosis Of Diabetes Mellitus,Differential Diagnosis Of Diabetes Mellitus Cost,Differential Diagnosis Of Diabetes Mellitus Center,Differential Diagnosis Of Diabetes Mellitus Center,Differential Diagnosis Of Diabetes Mellitus Near Me
Diphtheria Diagnosis,Diphtheria Diagnosis Cost,Diphtheria Diagnosis Center,Diphtheria Diagnosis Center,Diphtheria Diagnosis Near Me
Discharge Diagnosis,Discharge Diagnosis Cost,Discharge Diagnosis Center,Discharge Diagnosis Center,Discharge Diagnosis Near Me
Disease Diagnosis,Disease Diagnosis Cost,Disease Diagnosis Center,Disease Diagnosis Center,Disease Diagnosis Near Me
Dish Diagnosis,Dish Diagnosis Cost,Dish Diagnosis Center,Dish Diagnosis Center,Dish Diagnosis Near Me
Diverticulitis Diagnosis,Diverticulitis Diagnosis Cost,Diverticulitis Diagnosis Center,Diverticulitis Diagnosis Center,Diverticulitis Diagnosis Near Me
Dizziness Differential Diagnosis,Dizziness Differential Diagnosis Cost,Dizziness Differential Diagnosis Center,Dizziness Differential Diagnosis Center,Dizziness Differential Diagnosis Near Me
Dka Diagnosis,Dka Diagnosis Cost,Dka Diagnosis Center,Dka Diagnosis Center,Dka Diagnosis Near Me
Dka Nursing Diagnosis,Dka Nursing Diagnosis Cost,Dka Nursing Diagnosis Center,Dka Nursing Diagnosis Center,Dka Nursing Diagnosis Near Me
Dm Diagnosis,Dm Diagnosis Cost,Dm Diagnosis Center,Dm Diagnosis Center,Dm Diagnosis Near Me
Doctor Diagnosis,Doctor Diagnosis Cost,Doctor Diagnosis Center,Doctor Diagnosis Center,Doctor Diagnosis Near Me
Dvt Diagnosis,Dvt Diagnosis Cost,Dvt Diagnosis Center,Dvt Diagnosis Center,Dvt Diagnosis Near Me
Dvt Differential Diagnosis,Dvt Differential Diagnosis Cost,Dvt Differential Diagnosis Center,Dvt Differential Diagnosis Center,Dvt Differential Diagnosis Near Me
Dysautonomia Diagnosis,Dysautonomia Diagnosis Cost,Dysautonomia Diagnosis Center,Dysautonomia Diagnosis Center,Dysautonomia Diagnosis Near Me
Dysphagia Differential Diagnosis,Dysphagia Differential Diagnosis Cost,Dysphagia Differential Diagnosis Center,Dysphagia Differential Diagnosis Center,Dysphagia Differential Diagnosis Near Me
Dyspnea Differential Diagnosis,Dyspnea Differential Diagnosis Cost,Dyspnea Differential Diagnosis Center,Dyspnea Differential Diagnosis Center,Dyspnea Differential Diagnosis Near Me
Dysuria Differential Diagnosis,Dysuria Differential Diagnosis Cost,Dysuria Differential Diagnosis Center,Dysuria Differential Diagnosis Center,Dysuria Differential Diagnosis Near Me
Early Diagnosis,Early Diagnosis Cost,Early Diagnosis Center,Early Diagnosis Center,Early Diagnosis Near Me
Ebv Reactivation Diagnosis,Ebv Reactivation Diagnosis Cost,Ebv Reactivation Diagnosis Center,Ebv Reactivation Diagnosis Center,Ebv Reactivation Diagnosis Near Me
Ectopic Pregnancy Differential Diagnosis,Ectopic Pregnancy Differential Diagnosis Cost,Ectopic Pregnancy Differential Diagnosis Center,Ectopic Pregnancy Differential Diagnosis Center,Ectopic Pregnancy Differential Diagnosis Near Me
Eczema Diagnosis,Eczema Diagnosis Cost,Eczema Diagnosis Center,Eczema Diagnosis Center,Eczema Diagnosis Near Me
Elbow Pain Diagnosis,Elbow Pain Diagnosis Cost,Elbow Pain Diagnosis Center,Elbow Pain Diagnosis Center,Elbow Pain Diagnosis Near Me
Electrolyte Imbalance Nursing Diagnosis,Electrolyte Imbalance Nursing Diagnosis Cost,Electrolyte Imbalance Nursing Diagnosis Center,Electrolyte Imbalance Nursing Diagnosis Center,Electrolyte Imbalance Nursing Diagnosis Near Me
Elevated Alkaline Phosphatase Differential Diagnosis,Elevated Alkaline Phosphatase Differential Diagnosis Cost,Elevated Alkaline Phosphatase Differential Diagnosis Center,Elevated Alkaline Phosphatase Differential Diagnosis Center,Elevated Alkaline Phosphatase Differential Diagnosis Near Me
Elevated Cpk Differential Diagnosis,Elevated Cpk Differential Diagnosis Cost,Elevated Cpk Differential Diagnosis Center,Elevated Cpk Differential Diagnosis Center,Elevated Cpk Differential Diagnosis Near Me
Elevated Ldh Differential Diagnosis,Elevated Ldh Differential Diagnosis Cost,Elevated Ldh Differential Diagnosis Center,Elevated Ldh Differential Diagnosis Center,Elevated Ldh Differential Diagnosis Near Me
Emphysema Diagnosis,Emphysema Diagnosis Cost,Emphysema Diagnosis Center,Emphysema Diagnosis Center,Emphysema Diagnosis Near Me
Encephalitis Diagnosis,Encephalitis Diagnosis Cost,Encephalitis Diagnosis Center,Encephalitis Diagnosis Center,Encephalitis Diagnosis Near Me
Endocarditis Diagnosis,Endocarditis Diagnosis Cost,Endocarditis Diagnosis Center,Endocarditis Diagnosis Center,Endocarditis Diagnosis Near Me
Endometrial Cancer Diagnosis,Endometrial Cancer Diagnosis Cost,Endometrial Cancer Diagnosis Center,Endometrial Cancer Diagnosis Center,Endometrial Cancer Diagnosis Near Me
Endometriosis Diagnosis,Endometriosis Diagnosis Cost,Endometriosis Diagnosis Center,Endometriosis Diagnosis Center,Endometriosis Diagnosis Near Me
Enteric Fever Diagnosis,Enteric Fever Diagnosis Cost,Enteric Fever Diagnosis Center,Enteric Fever Diagnosis Center,Enteric Fever Diagnosis Near Me
Eoe Diagnosis,Eoe Diagnosis Cost,Eoe Diagnosis Center,Eoe Diagnosis Center,Eoe Diagnosis Near Me
Epi Diagnosis,Epi Diagnosis Cost,Epi Diagnosis Center,Epi Diagnosis Center,Epi Diagnosis Near Me
Epigastric Mass Differential Diagnosis,Epigastric Mass Differential Diagnosis Cost,Epigastric Mass Differential Diagnosis Center,Epigastric Mass Differential Diagnosis Center,Epigastric Mass Differential Diagnosis Near Me
Epigastric Pain Differential Diagnosis,Epigastric Pain Differential Diagnosis Cost,Epigastric Pain Differential Diagnosis Center,Epigastric Pain Differential Diagnosis Center,Epigastric Pain Differential Diagnosis Near Me
Epilepsy Diagnosis,Epilepsy Diagnosis Cost,Epilepsy Diagnosis Center,Epilepsy Diagnosis Center,Epilepsy Diagnosis Near Me
Erythema Multiforme Differential Diagnosis,Erythema Multiforme Differential Diagnosis Cost,Erythema Multiforme Differential Diagnosis Center,Erythema Multiforme Differential Diagnosis Center,Erythema Multiforme Differential Diagnosis Near Me
Erythema Nodosum Differential Diagnosis,Erythema Nodosum Differential Diagnosis Cost,Erythema Nodosum Differential Diagnosis Center,Erythema Nodosum Differential Diagnosis Center,Erythema Nodosum Differential Diagnosis Near Me
Esophageal Cancer Diagnosis,Esophageal Cancer Diagnosis Cost,Esophageal Cancer Diagnosis Center,Esophageal Cancer Diagnosis Center,Esophageal Cancer Diagnosis Near Me
Esophageal Ulcer Diagnosis,Esophageal Ulcer Diagnosis Cost,Esophageal Ulcer Diagnosis Center,Esophageal Ulcer Diagnosis Center,Esophageal Ulcer Diagnosis Near Me
Evidence Based Physical Diagnosis,Evidence Based Physical Diagnosis Cost,Evidence Based Physical Diagnosis Center,Evidence Based Physical Diagnosis Center,Evidence Based Physical Diagnosis Near Me
Eye Diagnosis,Eye Diagnosis Cost,Eye Diagnosis Center,Eye Diagnosis Center,Eye Diagnosis Near Me
F29 Diagnosis,F29 Diagnosis Cost,F29 Diagnosis Center,F29 Diagnosis Center,F29 Diagnosis Near Me
F32 Diagnosis,F32 Diagnosis Cost,F32 Diagnosis Center,F32 Diagnosis Center,F32 Diagnosis Near Me
F33 1 Diagnosis,F33 1 Diagnosis Cost,F33 1 Diagnosis Center,F33 1 Diagnosis Center,F33 1 Diagnosis Near Me
F33 2 Diagnosis,F33 2 Diagnosis Cost,F33 2 Diagnosis Center,F33 2 Diagnosis Center,F33 2 Diagnosis Near Me
F41 1 Diagnosis,F41 1 Diagnosis Cost,F41 1 Diagnosis Center,F41 1 Diagnosis Center,F41 1 Diagnosis Near Me
F41 9 Diagnosis,F41 9 Diagnosis Cost,F41 9 Diagnosis Center,F41 9 Diagnosis Center,F41 9 Diagnosis Near Me
F43 23 Diagnosis,F43 23 Diagnosis Cost,F43 23 Diagnosis Center,F43 23 Diagnosis Center,F43 23 Diagnosis Near Me
Fabry Disease Diagnosis,Fabry Disease Diagnosis Cost,Fabry Disease Diagnosis Center,Fabry Disease Diagnosis Center,Fabry Disease Diagnosis Near Me
Failure To Thrive Diagnosis,Failure To Thrive Diagnosis Cost,Failure To Thrive Diagnosis Center,Failure To Thrive Diagnosis Center,Failure To Thrive Diagnosis Near Me
Fasd Diagnosis,Fasd Diagnosis Cost,Fasd Diagnosis Center,Fasd Diagnosis Center,Fasd Diagnosis Near Me
Fatigue Differential Diagnosis,Fatigue Differential Diagnosis Cost,Fatigue Differential Diagnosis Center,Fatigue Differential Diagnosis Center,Fatigue Differential Diagnosis Near Me
Fatty Liver Diagnosis,Fatty Liver Diagnosis Cost,Fatty Liver Diagnosis Center,Fatty Liver Diagnosis Center,Fatty Liver Diagnosis Near Me
Fever Diagnosis,Fever Diagnosis Cost,Fever Diagnosis Center,Fever Diagnosis Center,Fever Diagnosis Near Me
Fever Differential Diagnosis,Fever Differential Diagnosis Cost,Fever Differential Diagnosis Center,Fever Differential Diagnosis Center,Fever Differential Diagnosis Near Me
Fever With Chills Differential Diagnosis,Fever With Chills Differential Diagnosis Cost,Fever With Chills Differential Diagnosis Center,Fever With Chills Differential Diagnosis Center,Fever With Chills Differential Diagnosis Near Me
Fever With Rash Differential Diagnosis,Fever With Rash Differential Diagnosis Cost,Fever With Rash Differential Diagnosis Center,Fever With Rash Differential Diagnosis Center,Fever With Rash Differential Diagnosis Near Me
Fibromyalgia Diagnosis,Fibromyalgia Diagnosis Cost,Fibromyalgia Diagnosis Center,Fibromyalgia Diagnosis Center,Fibromyalgia Diagnosis Near Me
Final Diagnosis,Final Diagnosis Cost,Final Diagnosis Center,Final Diagnosis Center,Final Diagnosis Near Me
Flank Pain Differential Diagnosis,Flank Pain Differential Diagnosis Cost,Flank Pain Differential Diagnosis Center,Flank Pain Differential Diagnosis Center,Flank Pain Differential Diagnosis Near Me
Fnd Diagnosis,Fnd Diagnosis Cost,Fnd Diagnosis Center,Fnd Diagnosis Center,Fnd Diagnosis Near Me
Food Poisoning Diagnosis,Food Poisoning Diagnosis Cost,Food Poisoning Diagnosis Center,Food Poisoning Diagnosis Center,Food Poisoning Diagnosis Near Me
Foot Drop Differential Diagnosis,Foot Drop Differential Diagnosis Cost,Foot Drop Differential Diagnosis Center,Foot Drop Differential Diagnosis Center,Foot Drop Differential Diagnosis Near Me
Foot Pain Diagnosis,Foot Pain Diagnosis Cost,Foot Pain Diagnosis Center,Foot Pain Diagnosis Center,Foot Pain Diagnosis Near Me
Foot Pain Diagnosis Chart,Foot Pain Diagnosis Chart Cost,Foot Pain Diagnosis Chart Center,Foot Pain Diagnosis Chart Center,Foot Pain Diagnosis Chart Near Me
Frozen Shoulder Diagnosis,Frozen Shoulder Diagnosis Cost,Frozen Shoulder Diagnosis Center,Frozen Shoulder Diagnosis Center,Frozen Shoulder Diagnosis Near Me
Gad Diagnosis,Gad Diagnosis Cost,Gad Diagnosis Center,Gad Diagnosis Center,Gad Diagnosis Near Me
Gallbladder Diagnosis,Gallbladder Diagnosis Cost,Gallbladder Diagnosis Center,Gallbladder Diagnosis Center,Gallbladder Diagnosis Near Me
Gallstones Diagnosis,Gallstones Diagnosis Cost,Gallstones Diagnosis Center,Gallstones Diagnosis Center,Gallstones Diagnosis Near Me
Gastritis Diagnosis,Gastritis Diagnosis Cost,Gastritis Diagnosis Center,Gastritis Diagnosis Center,Gastritis Diagnosis Near Me
Gastroenteritis Diagnosis,Gastroenteritis Diagnosis Cost,Gastroenteritis Diagnosis Center,Gastroenteritis Diagnosis Center,Gastroenteritis Diagnosis Near Me
Gastroparesis Diagnosis,Gastroparesis Diagnosis Cost,Gastroparesis Diagnosis Center,Gastroparesis Diagnosis Center,Gastroparesis Diagnosis Near Me
Gbs Diagnosis,Gbs Diagnosis Cost,Gbs Diagnosis Center,Gbs Diagnosis Center,Gbs Diagnosis Near Me
Genital Herpes Diagnosis,Genital Herpes Diagnosis Cost,Genital Herpes Diagnosis Center,Genital Herpes Diagnosis Center,Genital Herpes Diagnosis Near Me
Gerd Diagnosis,Gerd Diagnosis Cost,Gerd Diagnosis Center,Gerd Diagnosis Center,Gerd Diagnosis Near Me
Gerd Differential Diagnosis,Gerd Differential Diagnosis Cost,Gerd Differential Diagnosis Center,Gerd Differential Diagnosis Center,Gerd Differential Diagnosis Near Me
Gerd Nursing Diagnosis,Gerd Nursing Diagnosis Cost,Gerd Nursing Diagnosis Center,Gerd Nursing Diagnosis Center,Gerd Nursing Diagnosis Near Me
Giant Cell Arteritis Diagnosis,Giant Cell Arteritis Diagnosis Cost,Giant Cell Arteritis Diagnosis Center,Giant Cell Arteritis Diagnosis Center,Giant Cell Arteritis Diagnosis Near Me
Giardiasis Diagnosis,Giardiasis Diagnosis Cost,Giardiasis Diagnosis Center,Giardiasis Diagnosis Center,Giardiasis Diagnosis Near Me
Gigantomastia Diagnosis,Gigantomastia Diagnosis Cost,Gigantomastia Diagnosis Center,Gigantomastia Diagnosis Center,Gigantomastia Diagnosis Near Me
Gilbert Syndrome Diagnosis,Gilbert Syndrome Diagnosis Cost,Gilbert Syndrome Diagnosis Center,Gilbert Syndrome Diagnosis Center,Gilbert Syndrome Diagnosis Near Me
Glaucoma Nursing Diagnosis,Glaucoma Nursing Diagnosis Cost,Glaucoma Nursing Diagnosis Center,Glaucoma Nursing Diagnosis Center,Glaucoma Nursing Diagnosis Near Me
Glomerulonephritis Diagnosis,Glomerulonephritis Diagnosis Cost,Glomerulonephritis Diagnosis Center,Glomerulonephritis Diagnosis Center,Glomerulonephritis Diagnosis Near Me
Gout Diagnosis,Gout Diagnosis Cost,Gout Diagnosis Center,Gout Diagnosis Center,Gout Diagnosis Near Me
Gout Differential Diagnosis,Gout Differential Diagnosis Cost,Gout Differential Diagnosis Center,Gout Differential Diagnosis Center,Gout Differential Diagnosis Near Me
Guillain Barre Diagnosis,Guillain Barre Diagnosis Cost,Guillain Barre Diagnosis Center,Guillain Barre Diagnosis Center,Guillain Barre Diagnosis Near Me
Guillain Barre Syndrome Diagnosis,Guillain Barre Syndrome Diagnosis Cost,Guillain Barre Syndrome Diagnosis Center,Guillain Barre Syndrome Diagnosis Center,Guillain Barre Syndrome Diagnosis Near Me
Guy Martin Diagnosis,Guy Martin Diagnosis Cost,Guy Martin Diagnosis Center,Guy Martin Diagnosis Center,Guy Martin Diagnosis Near Me
H Pylori Diagnosis,H Pylori Diagnosis Cost,H Pylori Diagnosis Center,H Pylori Diagnosis Center,H Pylori Diagnosis Near Me
Haemochromatosis Diagnosis,Haemochromatosis Diagnosis Cost,Haemochromatosis Diagnosis Center,Haemochromatosis Diagnosis Center,Haemochromatosis Diagnosis Near Me
Hcc Diagnosis,Hcc Diagnosis Cost,Hcc Diagnosis Center,Hcc Diagnosis Center,Hcc Diagnosis Near Me
Headache Diagnosis,Headache Diagnosis Cost,Headache Diagnosis Center,Headache Diagnosis Center,Headache Diagnosis Near Me
Headache Differential Diagnosis,Headache Differential Diagnosis Cost,Headache Differential Diagnosis Center,Headache Differential Diagnosis Center,Headache Differential Diagnosis Near Me
Health Diagnosis,Health Diagnosis Cost,Health Diagnosis Center,Health Diagnosis Center,Health Diagnosis Near Me
Heart Attack Diagnosis,Heart Attack Diagnosis Cost,Heart Attack Diagnosis Center,Heart Attack Diagnosis Center,Heart Attack Diagnosis Near Me
Heart Diagnosis,Heart Diagnosis Cost,Heart Diagnosis Center,Heart Diagnosis Center,Heart Diagnosis Near Me
Heart Disease Diagnosis,Heart Disease Diagnosis Cost,Heart Disease Diagnosis Center,Heart Disease Diagnosis Center,Heart Disease Diagnosis Near Me
Heart Failure Diagnosis,Heart Failure Diagnosis Cost,Heart Failure Diagnosis Center,Heart Failure Diagnosis Center,Heart Failure Diagnosis Near Me
Heart Failure Differential Diagnosis,Heart Failure Differential Diagnosis Cost,Heart Failure Differential Diagnosis Center,Heart Failure Differential Diagnosis Center,Heart Failure Differential Diagnosis Near Me
Heel Pain Diagnosis,Heel Pain Diagnosis Cost,Heel Pain Diagnosis Center,Heel Pain Diagnosis Center,Heel Pain Diagnosis Near Me
Hematemesis Differential Diagnosis,Hematemesis Differential Diagnosis Cost,Hematemesis Differential Diagnosis Center,Hematemesis Differential Diagnosis Center,Hematemesis Differential Diagnosis Near Me
Hematochezia Differential Diagnosis,Hematochezia Differential Diagnosis Cost,Hematochezia Differential Diagnosis Center,Hematochezia Differential Diagnosis Center,Hematochezia Differential Diagnosis Near Me
Hematuria Differential Diagnosis,Hematuria Differential Diagnosis Cost,Hematuria Differential Diagnosis Center,Hematuria Differential Diagnosis Center,Hematuria Differential Diagnosis Near Me
Hemochromatosis Diagnosis,Hemochromatosis Diagnosis Cost,Hemochromatosis Diagnosis Center,Hemochromatosis Diagnosis Center,Hemochromatosis Diagnosis Near Me
Hemolytic Anemia Diagnosis,Hemolytic Anemia Diagnosis Cost,Hemolytic Anemia Diagnosis Center,Hemolytic Anemia Diagnosis Center,Hemolytic Anemia Diagnosis Near Me
Hemophilia Diagnosis,Hemophilia Diagnosis Cost,Hemophilia Diagnosis Center,Hemophilia Diagnosis Center,Hemophilia Diagnosis Near Me
Hemoptysis Differential Diagnosis,Hemoptysis Differential Diagnosis Cost,Hemoptysis Differential Diagnosis Center,Hemoptysis Differential Diagnosis Center,Hemoptysis Differential Diagnosis Near Me
Henoch Schonlein Purpura Diagnosis,Henoch Schonlein Purpura Diagnosis Cost,Henoch Schonlein Purpura Diagnosis Center,Henoch Schonlein Purpura Diagnosis Center,Henoch Schonlein Purpura Diagnosis Near Me
Hepatic Encephalopathy Diagnosis,Hepatic Encephalopathy Diagnosis Cost,Hepatic Encephalopathy Diagnosis Center,Hepatic Encephalopathy Diagnosis Center,Hepatic Encephalopathy Diagnosis Near Me
Hepatitis A Diagnosis,Hepatitis A Diagnosis Cost,Hepatitis A Diagnosis Center,Hepatitis A Diagnosis Center,Hepatitis A Diagnosis Near Me
Hepatitis B Diagnosis,Hepatitis B Diagnosis Cost,Hepatitis B Diagnosis Center,Hepatitis B Diagnosis Center,Hepatitis B Diagnosis Near Me
Hepatitis C Diagnosis,Hepatitis C Diagnosis Cost,Hepatitis C Diagnosis Center,Hepatitis C Diagnosis Center,Hepatitis C Diagnosis Near Me
Hepatitis Diagnosis,Hepatitis Diagnosis Cost,Hepatitis Diagnosis Center,Hepatitis Diagnosis Center,Hepatitis Diagnosis Near Me
Hepatosplenomegaly Differential Diagnosis,Hepatosplenomegaly Differential Diagnosis Cost,Hepatosplenomegaly Differential Diagnosis Center,Hepatosplenomegaly Differential Diagnosis Center,Hepatosplenomegaly Differential Diagnosis Near Me
Hereditary Spherocytosis Diagnosis,Hereditary Spherocytosis Diagnosis Cost,Hereditary Spherocytosis Diagnosis Center,Hereditary Spherocytosis Diagnosis Center,Hereditary Spherocytosis Diagnosis Near Me
Hernia Diagnosis,Hernia Diagnosis Cost,Hernia Diagnosis Center,Hernia Diagnosis Center,Hernia Diagnosis Near Me
Herniated Disc Diagnosis,Herniated Disc Diagnosis Cost,Herniated Disc Diagnosis Center,Herniated Disc Diagnosis Center,Herniated Disc Diagnosis Near Me
Herpes Diagnosis,Herpes Diagnosis Cost,Herpes Diagnosis Center,Herpes Diagnosis Center,Herpes Diagnosis Near Me
Hhs Diagnosis,Hhs Diagnosis Cost,Hhs Diagnosis Center,Hhs Diagnosis Center,Hhs Diagnosis Near Me
Hht Diagnosis,Hht Diagnosis Cost,Hht Diagnosis Center,Hht Diagnosis Center,Hht Diagnosis Near Me
Hiatal Hernia Diagnosis,Hiatal Hernia Diagnosis Cost,Hiatal Hernia Diagnosis Center,Hiatal Hernia Diagnosis Center,Hiatal Hernia Diagnosis Near Me
High Blood Pressure Diagnosis,High Blood Pressure Diagnosis Cost,High Blood Pressure Diagnosis Center,High Blood Pressure Diagnosis Center,High Blood Pressure Diagnosis Near Me
High C3 And C4 Differential Diagnosis,High C3 And C4 Differential Diagnosis Cost,High C3 And C4 Differential Diagnosis Center,High C3 And C4 Differential Diagnosis Center,High C3 And C4 Differential Diagnosis Near Me
Hip Pain Diagnosis,Hip Pain Diagnosis Cost,Hip Pain Diagnosis Center,Hip Pain Diagnosis Center,Hip Pain Diagnosis Near Me
Hip Pain Differential Diagnosis,Hip Pain Differential Diagnosis Cost,Hip Pain Differential Diagnosis Center,Hip Pain Differential Diagnosis Center,Hip Pain Differential Diagnosis Near Me
Hirschsprung Disease Diagnosis,Hirschsprung Disease Diagnosis Cost,Hirschsprung Disease Diagnosis Center,Hirschsprung Disease Diagnosis Center,Hirschsprung Disease Diagnosis Near Me
Histoplasmosis Diagnosis,Histoplasmosis Diagnosis Cost,Histoplasmosis Diagnosis Center,Histoplasmosis Diagnosis Center,Histoplasmosis Diagnosis Near Me
Hit Diagnosis,Hit Diagnosis Cost,Hit Diagnosis Center,Hit Diagnosis Center,Hit Diagnosis Near Me
Hlh Diagnosis,Hlh Diagnosis Cost,Hlh Diagnosis Center,Hlh Diagnosis Center,Hlh Diagnosis Near Me
Hodgkin'S Lymphoma Diagnosis,Hodgkin'S Lymphoma Diagnosis Cost,Hodgkin'S Lymphoma Diagnosis Center,Hodgkin'S Lymphoma Diagnosis Center,Hodgkin'S Lymphoma Diagnosis Near Me
Hookworm Diagnosis,Hookworm Diagnosis Cost,Hookworm Diagnosis Center,Hookworm Diagnosis Center,Hookworm Diagnosis Near Me
Hs Diagnosis,Hs Diagnosis Cost,Hs Diagnosis Center,Hs Diagnosis Center,Hs Diagnosis Near Me
Hsp Diagnosis,Hsp Diagnosis Cost,Hsp Diagnosis Center,Hsp Diagnosis Center,Hsp Diagnosis Near Me
Hsv Diagnosis,Hsv Diagnosis Cost,Hsv Diagnosis Center,Hsv Diagnosis Center,Hsv Diagnosis Near Me
Htn Diagnosis,Htn Diagnosis Cost,Htn Diagnosis Center,Htn Diagnosis Center,Htn Diagnosis Near Me
Hus Diagnosis,Hus Diagnosis Cost,Hus Diagnosis Center,Hus Diagnosis Center,Hus Diagnosis Near Me
Hydrocephalus Diagnosis,Hydrocephalus Diagnosis Cost,Hydrocephalus Diagnosis Center,Hydrocephalus Diagnosis Center,Hydrocephalus Diagnosis Near Me
Hydronephrosis Diagnosis,Hydronephrosis Diagnosis Cost,Hydronephrosis Diagnosis Center,Hydronephrosis Diagnosis Center,Hydronephrosis Diagnosis Near Me
Hyperemesis Gravidarum Diagnosis,Hyperemesis Gravidarum Diagnosis Cost,Hyperemesis Gravidarum Diagnosis Center,Hyperemesis Gravidarum Diagnosis Center,Hyperemesis Gravidarum Diagnosis Near Me
Hyperglycemia Nursing Diagnosis,Hyperglycemia Nursing Diagnosis Cost,Hyperglycemia Nursing Diagnosis Center,Hyperglycemia Nursing Diagnosis Center,Hyperglycemia Nursing Diagnosis Near Me
Hypertension Diagnosis,Hypertension Diagnosis Cost,Hypertension Diagnosis Center,Hypertension Diagnosis Center,Hypertension Diagnosis Near Me
Hypertension Differential Diagnosis,Hypertension Differential Diagnosis Cost,Hypertension Differential Diagnosis Center,Hypertension Differential Diagnosis Center,Hypertension Differential Diagnosis Near Me
Hyperthermia Nursing Diagnosis,Hyperthermia Nursing Diagnosis Cost,Hyperthermia Nursing Diagnosis Center,Hyperthermia Nursing Diagnosis Center,Hyperthermia Nursing Diagnosis Near Me
Hypoglycemia Diagnosis,Hypoglycemia Diagnosis Cost,Hypoglycemia Diagnosis Center,Hypoglycemia Diagnosis Center,Hypoglycemia Diagnosis Near Me
Hypoglycemia Nursing Diagnosis,Hypoglycemia Nursing Diagnosis Cost,Hypoglycemia Nursing Diagnosis Center,Hypoglycemia Nursing Diagnosis Center,Hypoglycemia Nursing Diagnosis Near Me
Hypokalemia Nursing Diagnosis,Hypokalemia Nursing Diagnosis Cost,Hypokalemia Nursing Diagnosis Center,Hypokalemia Nursing Diagnosis Center,Hypokalemia Nursing Diagnosis Near Me
