name,cost,center,process,nearme
Hyponatremia Nursing Diagnosis,Hyponatremia Nursing Diagnosis Cost,Hyponatremia Nursing Diagnosis Center,Hyponatremia Nursing Diagnosis Center,Hyponatremia Nursing Diagnosis Near Me
Ibd Diagnosis,Ibd Diagnosis Cost,Ibd Diagnosis Center,Ibd Diagnosis Center,Ibd Diagnosis Near Me
Ibs Diagnosis,Ibs Diagnosis Cost,Ibs Diagnosis Center,Ibs Diagnosis Center,Ibs Diagnosis Near Me
Ida Diagnosis,Ida Diagnosis Cost,Ida Diagnosis Center,Ida Diagnosis Center,Ida Diagnosis Near Me
Ied Diagnosis,Ied Diagnosis Cost,Ied Diagnosis Center,Ied Diagnosis Center,Ied Diagnosis Near Me
Iga Nephropathy Diagnosis,Iga Nephropathy Diagnosis Cost,Iga Nephropathy Diagnosis Center,Iga Nephropathy Diagnosis Center,Iga Nephropathy Diagnosis Near Me
Iih Diagnosis,Iih Diagnosis Cost,Iih Diagnosis Center,Iih Diagnosis Center,Iih Diagnosis Near Me
Ileus Diagnosis,Ileus Diagnosis Cost,Ileus Diagnosis Center,Ileus Diagnosis Center,Ileus Diagnosis Near Me
Infectious Mononucleosis Diagnosis,Infectious Mononucleosis Diagnosis Cost,Infectious Mononucleosis Diagnosis Center,Infectious Mononucleosis Diagnosis Center,Infectious Mononucleosis Diagnosis Near Me
Infective Endocarditis Diagnosis,Infective Endocarditis Diagnosis Cost,Infective Endocarditis Diagnosis Center,Infective Endocarditis Diagnosis Center,Infective Endocarditis Diagnosis Near Me
Inflammatory Bowel Disease Diagnosis,Inflammatory Bowel Disease Diagnosis Cost,Inflammatory Bowel Disease Diagnosis Center,Inflammatory Bowel Disease Diagnosis Center,Inflammatory Bowel Disease Diagnosis Near Me
Inguinal Hernia Diagnosis,Inguinal Hernia Diagnosis Cost,Inguinal Hernia Diagnosis Center,Inguinal Hernia Diagnosis Center,Inguinal Hernia Diagnosis Near Me
Inguinal Hernia Differential Diagnosis,Inguinal Hernia Differential Diagnosis Cost,Inguinal Hernia Differential Diagnosis Center,Inguinal Hernia Differential Diagnosis Center,Inguinal Hernia Differential Diagnosis Near Me
Initial Diagnosis,Initial Diagnosis Cost,Initial Diagnosis Center,Initial Diagnosis Center,Initial Diagnosis Near Me
Insomnia Diagnosis,Insomnia Diagnosis Cost,Insomnia Diagnosis Center,Insomnia Diagnosis Center,Insomnia Diagnosis Near Me
Insulinoma Diagnosis,Insulinoma Diagnosis Cost,Insulinoma Diagnosis Center,Insulinoma Diagnosis Center,Insulinoma Diagnosis Near Me
Interstitial Cystitis Diagnosis,Interstitial Cystitis Diagnosis Cost,Interstitial Cystitis Diagnosis Center,Interstitial Cystitis Diagnosis Center,Interstitial Cystitis Diagnosis Near Me
Intussusception Diagnosis,Intussusception Diagnosis Cost,Intussusception Diagnosis Center,Intussusception Diagnosis Center,Intussusception Diagnosis Near Me
Ipf Diagnosis,Ipf Diagnosis Cost,Ipf Diagnosis Center,Ipf Diagnosis Center,Ipf Diagnosis Near Me
Iron Deficiency Anemia Diagnosis,Iron Deficiency Anemia Diagnosis Cost,Iron Deficiency Anemia Diagnosis Center,Iron Deficiency Anemia Diagnosis Center,Iron Deficiency Anemia Diagnosis Near Me
Irritable Bowel Syndrome Diagnosis,Irritable Bowel Syndrome Diagnosis Cost,Irritable Bowel Syndrome Diagnosis Center,Irritable Bowel Syndrome Diagnosis Center,Irritable Bowel Syndrome Diagnosis Near Me
Itp Diagnosis,Itp Diagnosis Cost,Itp Diagnosis Center,Itp Diagnosis Center,Itp Diagnosis Near Me
Jaundice Diagnosis,Jaundice Diagnosis Cost,Jaundice Diagnosis Center,Jaundice Diagnosis Center,Jaundice Diagnosis Near Me
Jaundice Nursing Diagnosis,Jaundice Nursing Diagnosis Cost,Jaundice Nursing Diagnosis Center,Jaundice Nursing Diagnosis Center,Jaundice Nursing Diagnosis Near Me
Joint Pain Differential Diagnosis,Joint Pain Differential Diagnosis Cost,Joint Pain Differential Diagnosis Center,Joint Pain Differential Diagnosis Center,Joint Pain Differential Diagnosis Near Me
Juvenile Gigantomastia Diagnosis,Juvenile Gigantomastia Diagnosis Cost,Juvenile Gigantomastia Diagnosis Center,Juvenile Gigantomastia Diagnosis Center,Juvenile Gigantomastia Diagnosis Near Me
Kawasaki Disease Diagnosis,Kawasaki Disease Diagnosis Cost,Kawasaki Disease Diagnosis Center,Kawasaki Disease Diagnosis Center,Kawasaki Disease Diagnosis Near Me
Kidney Cancer Diagnosis,Kidney Cancer Diagnosis Cost,Kidney Cancer Diagnosis Center,Kidney Cancer Diagnosis Center,Kidney Cancer Diagnosis Near Me
Kidney Diagnosis,Kidney Diagnosis Cost,Kidney Diagnosis Center,Kidney Diagnosis Center,Kidney Diagnosis Near Me
Kidney Disease Diagnosis,Kidney Disease Diagnosis Cost,Kidney Disease Diagnosis Center,Kidney Disease Diagnosis Center,Kidney Disease Diagnosis Near Me
Kidney Failure Diagnosis,Kidney Failure Diagnosis Cost,Kidney Failure Diagnosis Center,Kidney Failure Diagnosis Center,Kidney Failure Diagnosis Near Me
Kidney Infection Diagnosis,Kidney Infection Diagnosis Cost,Kidney Infection Diagnosis Center,Kidney Infection Diagnosis Center,Kidney Infection Diagnosis Near Me
Kidney Stone Diagnosis,Kidney Stone Diagnosis Cost,Kidney Stone Diagnosis Center,Kidney Stone Diagnosis Center,Kidney Stone Diagnosis Near Me
Klebsiella Pneumoniae Diagnosis,Klebsiella Pneumoniae Diagnosis Cost,Klebsiella Pneumoniae Diagnosis Center,Klebsiella Pneumoniae Diagnosis Center,Klebsiella Pneumoniae Diagnosis Near Me
Knee Pain Diagnosis,Knee Pain Diagnosis Cost,Knee Pain Diagnosis Center,Knee Pain Diagnosis Center,Knee Pain Diagnosis Near Me
Knee Pain Differential Diagnosis,Knee Pain Differential Diagnosis Cost,Knee Pain Differential Diagnosis Center,Knee Pain Differential Diagnosis Center,Knee Pain Differential Diagnosis Near Me
Laboratory Diagnosis,Laboratory Diagnosis Cost,Laboratory Diagnosis Center,Laboratory Diagnosis Center,Laboratory Diagnosis Near Me
Lashay Diagnosis,Lashay Diagnosis Cost,Lashay Diagnosis Center,Lashay Diagnosis Center,Lashay Diagnosis Near Me
Leaky Gut Diagnosis,Leaky Gut Diagnosis Cost,Leaky Gut Diagnosis Center,Leaky Gut Diagnosis Center,Leaky Gut Diagnosis Near Me
Left Iliac Fossa Pain Differential Diagnosis,Left Iliac Fossa Pain Differential Diagnosis Cost,Left Iliac Fossa Pain Differential Diagnosis Center,Left Iliac Fossa Pain Differential Diagnosis Center,Left Iliac Fossa Pain Differential Diagnosis Near Me
Left Upper Quadrant Pain Differential Diagnosis,Left Upper Quadrant Pain Differential Diagnosis Cost,Left Upper Quadrant Pain Differential Diagnosis Center,Left Upper Quadrant Pain Differential Diagnosis Center,Left Upper Quadrant Pain Differential Diagnosis Near Me
Leprosy Diagnosis,Leprosy Diagnosis Cost,Leprosy Diagnosis Center,Leprosy Diagnosis Center,Leprosy Diagnosis Near Me
Leptospirosis Diagnosis,Leptospirosis Diagnosis Cost,Leptospirosis Diagnosis Center,Leptospirosis Diagnosis Center,Leptospirosis Diagnosis Near Me
Leukemia Diagnosis,Leukemia Diagnosis Cost,Leukemia Diagnosis Center,Leukemia Diagnosis Center,Leukemia Diagnosis Near Me
Leukocoria Differential Diagnosis,Leukocoria Differential Diagnosis Cost,Leukocoria Differential Diagnosis Center,Leukocoria Differential Diagnosis Center,Leukocoria Differential Diagnosis Near Me
Lipedema Diagnosis,Lipedema Diagnosis Cost,Lipedema Diagnosis Center,Lipedema Diagnosis Center,Lipedema Diagnosis Near Me
Lipoma Diagnosis,Lipoma Diagnosis Cost,Lipoma Diagnosis Center,Lipoma Diagnosis Center,Lipoma Diagnosis Near Me
Lipoma Differential Diagnosis,Lipoma Differential Diagnosis Cost,Lipoma Differential Diagnosis Center,Lipoma Differential Diagnosis Center,Lipoma Differential Diagnosis Near Me
List Of Differential Diagnosis,List Of Differential Diagnosis Cost,List Of Differential Diagnosis Center,List Of Differential Diagnosis Center,List Of Differential Diagnosis Near Me
Liver Cancer Diagnosis,Liver Cancer Diagnosis Cost,Liver Cancer Diagnosis Center,Liver Cancer Diagnosis Center,Liver Cancer Diagnosis Near Me
Liver Cirrhosis Diagnosis,Liver Cirrhosis Diagnosis Cost,Liver Cirrhosis Diagnosis Center,Liver Cirrhosis Diagnosis Center,Liver Cirrhosis Diagnosis Near Me
Liver Disease Diagnosis,Liver Disease Diagnosis Cost,Liver Disease Diagnosis Center,Liver Disease Diagnosis Center,Liver Disease Diagnosis Near Me
Liver Mass Differential Diagnosis,Liver Mass Differential Diagnosis Cost,Liver Mass Differential Diagnosis Center,Liver Mass Differential Diagnosis Center,Liver Mass Differential Diagnosis Near Me
Low Back Pain Differential Diagnosis,Low Back Pain Differential Diagnosis Cost,Low Back Pain Differential Diagnosis Center,Low Back Pain Differential Diagnosis Center,Low Back Pain Differential Diagnosis Near Me
Lower Back Pain Diagnosis,Lower Back Pain Diagnosis Cost,Lower Back Pain Diagnosis Center,Lower Back Pain Diagnosis Center,Lower Back Pain Diagnosis Near Me
Lower Limb Weakness Differential Diagnosis,Lower Limb Weakness Differential Diagnosis Cost,Lower Limb Weakness Differential Diagnosis Center,Lower Limb Weakness Differential Diagnosis Center,Lower Limb Weakness Differential Diagnosis Near Me
Lrti Diagnosis,Lrti Diagnosis Cost,Lrti Diagnosis Center,Lrti Diagnosis Center,Lrti Diagnosis Near Me
Lung Cancer Diagnosis,Lung Cancer Diagnosis Cost,Lung Cancer Diagnosis Center,Lung Cancer Diagnosis Center,Lung Cancer Diagnosis Near Me
Lung Consolidation Differential Diagnosis,Lung Consolidation Differential Diagnosis Cost,Lung Consolidation Differential Diagnosis Center,Lung Consolidation Differential Diagnosis Center,Lung Consolidation Differential Diagnosis Near Me
Lupus Diagnosis,Lupus Diagnosis Cost,Lupus Diagnosis Center,Lupus Diagnosis Center,Lupus Diagnosis Near Me
Lyme Disease Diagnosis,Lyme Disease Diagnosis Cost,Lyme Disease Diagnosis Center,Lyme Disease Diagnosis Center,Lyme Disease Diagnosis Near Me
Lymphedema Diagnosis,Lymphedema Diagnosis Cost,Lymphedema Diagnosis Center,Lymphedema Diagnosis Center,Lymphedema Diagnosis Near Me
Lymphoma Diagnosis,Lymphoma Diagnosis Cost,Lymphoma Diagnosis Center,Lymphoma Diagnosis Center,Lymphoma Diagnosis Near Me
M545 Diagnosis,M545 Diagnosis Cost,M545 Diagnosis Center,M545 Diagnosis Center,M545 Diagnosis Near Me
Macleod'S Clinical Diagnosis,Macleod'S Clinical Diagnosis Cost,Macleod'S Clinical Diagnosis Center,Macleod'S Clinical Diagnosis Center,Macleod'S Clinical Diagnosis Near Me
Maculopapular Rash Differential Diagnosis,Maculopapular Rash Differential Diagnosis Cost,Maculopapular Rash Differential Diagnosis Center,Maculopapular Rash Differential Diagnosis Center,Maculopapular Rash Differential Diagnosis Near Me
Major Depressive Disorder Diagnosis,Major Depressive Disorder Diagnosis Cost,Major Depressive Disorder Diagnosis Center,Major Depressive Disorder Diagnosis Center,Major Depressive Disorder Diagnosis Near Me
Malar Rash Differential Diagnosis,Malar Rash Differential Diagnosis Cost,Malar Rash Differential Diagnosis Center,Malar Rash Differential Diagnosis Center,Malar Rash Differential Diagnosis Near Me
Mals Diagnosis,Mals Diagnosis Cost,Mals Diagnosis Center,Mals Diagnosis Center,Mals Diagnosis Near Me
Marfan Syndrome Diagnosis,Marfan Syndrome Diagnosis Cost,Marfan Syndrome Diagnosis Center,Marfan Syndrome Diagnosis Center,Marfan Syndrome Diagnosis Near Me
Mastocytosis Diagnosis,Mastocytosis Diagnosis Cost,Mastocytosis Diagnosis Center,Mastocytosis Diagnosis Center,Mastocytosis Diagnosis Near Me
Mci Diagnosis,Mci Diagnosis Cost,Mci Diagnosis Center,Mci Diagnosis Center,Mci Diagnosis Near Me
Md Diagnosis,Md Diagnosis Cost,Md Diagnosis Center,Md Diagnosis Center,Md Diagnosis Near Me
Mdd Diagnosis,Mdd Diagnosis Cost,Mdd Diagnosis Center,Mdd Diagnosis Center,Mdd Diagnosis Near Me
Mds Diagnosis,Mds Diagnosis Cost,Mds Diagnosis Center,Mds Diagnosis Center,Mds Diagnosis Near Me
Measles Diagnosis,Measles Diagnosis Cost,Measles Diagnosis Center,Measles Diagnosis Center,Measles Diagnosis Near Me
Medical Diagnosis,Medical Diagnosis Cost,Medical Diagnosis Center,Medical Diagnosis Center,Medical Diagnosis Near Me
Megaloblastic Anemia Diagnosis,Megaloblastic Anemia Diagnosis Cost,Megaloblastic Anemia Diagnosis Center,Megaloblastic Anemia Diagnosis Center,Megaloblastic Anemia Diagnosis Near Me
Meningitis Nursing Diagnosis,Meningitis Nursing Diagnosis Cost,Meningitis Nursing Diagnosis Center,Meningitis Nursing Diagnosis Center,Meningitis Nursing Diagnosis Near Me
Mesothelioma Diagnosis,Mesothelioma Diagnosis Cost,Mesothelioma Diagnosis Center,Mesothelioma Diagnosis Center,Mesothelioma Diagnosis Near Me
Metabolic Acidosis Diagnosis,Metabolic Acidosis Diagnosis Cost,Metabolic Acidosis Diagnosis Center,Metabolic Acidosis Diagnosis Center,Metabolic Acidosis Diagnosis Near Me
Metabolic Syndrome Diagnosis,Metabolic Syndrome Diagnosis Cost,Metabolic Syndrome Diagnosis Center,Metabolic Syndrome Diagnosis Center,Metabolic Syndrome Diagnosis Near Me
Methemoglobinemia Diagnosis,Methemoglobinemia Diagnosis Cost,Methemoglobinemia Diagnosis Center,Methemoglobinemia Diagnosis Center,Methemoglobinemia Diagnosis Near Me
Mg Diagnosis,Mg Diagnosis Cost,Mg Diagnosis Center,Mg Diagnosis Center,Mg Diagnosis Near Me
Mgus Diagnosis,Mgus Diagnosis Cost,Mgus Diagnosis Center,Mgus Diagnosis Center,Mgus Diagnosis Near Me
Mi Diagnosis,Mi Diagnosis Cost,Mi Diagnosis Center,Mi Diagnosis Center,Mi Diagnosis Near Me
Mi Nursing Diagnosis,Mi Nursing Diagnosis Cost,Mi Nursing Diagnosis Center,Mi Nursing Diagnosis Center,Mi Nursing Diagnosis Near Me
Michael J Fox Diagnosis,Michael J Fox Diagnosis Cost,Michael J Fox Diagnosis Center,Michael J Fox Diagnosis Center,Michael J Fox Diagnosis Near Me
Microperforate Hymen Diagnosis,Microperforate Hymen Diagnosis Cost,Microperforate Hymen Diagnosis Center,Microperforate Hymen Diagnosis Center,Microperforate Hymen Diagnosis Near Me
Migraine Diagnosis,Migraine Diagnosis Cost,Migraine Diagnosis Center,Migraine Diagnosis Center,Migraine Diagnosis Near Me
Migraine Differential Diagnosis,Migraine Differential Diagnosis Cost,Migraine Differential Diagnosis Center,Migraine Differential Diagnosis Center,Migraine Differential Diagnosis Near Me
Mnd Diagnosis,Mnd Diagnosis Cost,Mnd Diagnosis Center,Mnd Diagnosis Center,Mnd Diagnosis Near Me
Mono Diagnosis,Mono Diagnosis Cost,Mono Diagnosis Center,Mono Diagnosis Center,Mono Diagnosis Near Me
Mononucleosis Diagnosis,Mononucleosis Diagnosis Cost,Mononucleosis Diagnosis Center,Mononucleosis Diagnosis Center,Mononucleosis Diagnosis Near Me
Motor Neurone Disease Diagnosis,Motor Neurone Disease Diagnosis Cost,Motor Neurone Disease Diagnosis Center,Motor Neurone Disease Diagnosis Center,Motor Neurone Disease Diagnosis Near Me
Mrcp Diagnosis,Mrcp Diagnosis Cost,Mrcp Diagnosis Center,Mrcp Diagnosis Center,Mrcp Diagnosis Near Me
Mrsa Diagnosis,Mrsa Diagnosis Cost,Mrsa Diagnosis Center,Mrsa Diagnosis Center,Mrsa Diagnosis Near Me
Ms Diagnosis,Ms Diagnosis Cost,Ms Diagnosis Center,Ms Diagnosis Center,Ms Diagnosis Near Me
Ms Differential Diagnosis,Ms Differential Diagnosis Cost,Ms Differential Diagnosis Center,Ms Differential Diagnosis Center,Ms Differential Diagnosis Near Me
Mucormycosis Diagnosis,Mucormycosis Diagnosis Cost,Mucormycosis Diagnosis Center,Mucormycosis Diagnosis Center,Mucormycosis Diagnosis Near Me
Multiple Myeloma Diagnosis,Multiple Myeloma Diagnosis Cost,Multiple Myeloma Diagnosis Center,Multiple Myeloma Diagnosis Center,Multiple Myeloma Diagnosis Near Me
Multiple Sclerosis Diagnosis,Multiple Sclerosis Diagnosis Cost,Multiple Sclerosis Diagnosis Center,Multiple Sclerosis Diagnosis Center,Multiple Sclerosis Diagnosis Near Me
Multiple Sclerosis Differential Diagnosis,Multiple Sclerosis Differential Diagnosis Cost,Multiple Sclerosis Differential Diagnosis Center,Multiple Sclerosis Differential Diagnosis Center,Multiple Sclerosis Differential Diagnosis Near Me
Multiple Symptom Checker Diagnosis,Multiple Symptom Checker Diagnosis Cost,Multiple Symptom Checker Diagnosis Center,Multiple Symptom Checker Diagnosis Center,Multiple Symptom Checker Diagnosis Near Me
Mumps Diagnosis,Mumps Diagnosis Cost,Mumps Diagnosis Center,Mumps Diagnosis Center,Mumps Diagnosis Near Me
Myasthenia Gravis Diagnosis,Myasthenia Gravis Diagnosis Cost,Myasthenia Gravis Diagnosis Center,Myasthenia Gravis Diagnosis Center,Myasthenia Gravis Diagnosis Near Me
Myasthenia Gravis Differential Diagnosis,Myasthenia Gravis Differential Diagnosis Cost,Myasthenia Gravis Differential Diagnosis Center,Myasthenia Gravis Differential Diagnosis Center,Myasthenia Gravis Differential Diagnosis Near Me
Myelodysplastic Syndrome Diagnosis,Myelodysplastic Syndrome Diagnosis Cost,Myelodysplastic Syndrome Diagnosis Center,Myelodysplastic Syndrome Diagnosis Center,Myelodysplastic Syndrome Diagnosis Near Me
Myeloma Diagnosis,Myeloma Diagnosis Cost,Myeloma Diagnosis Center,Myeloma Diagnosis Center,Myeloma Diagnosis Near Me
Myocardial Infarction Diagnosis,Myocardial Infarction Diagnosis Cost,Myocardial Infarction Diagnosis Center,Myocardial Infarction Diagnosis Center,Myocardial Infarction Diagnosis Near Me
Myocardial Infarction Nursing Diagnosis,Myocardial Infarction Nursing Diagnosis Cost,Myocardial Infarction Nursing Diagnosis Center,Myocardial Infarction Nursing Diagnosis Center,Myocardial Infarction Nursing Diagnosis Near Me
Myocarditis Diagnosis,Myocarditis Diagnosis Cost,Myocarditis Diagnosis Center,Myocarditis Diagnosis Center,Myocarditis Diagnosis Near Me
Myositis Diagnosis,Myositis Diagnosis Cost,Myositis Diagnosis Center,Myositis Diagnosis Center,Myositis Diagnosis Near Me
Mystery Diagnosis,Mystery Diagnosis Cost,Mystery Diagnosis Center,Mystery Diagnosis Center,Mystery Diagnosis Near Me
Nafld Diagnosis,Nafld Diagnosis Cost,Nafld Diagnosis Center,Nafld Diagnosis Center,Nafld Diagnosis Near Me
Nash Diagnosis,Nash Diagnosis Cost,Nash Diagnosis Center,Nash Diagnosis Center,Nash Diagnosis Near Me
Nausea Nursing Diagnosis,Nausea Nursing Diagnosis Cost,Nausea Nursing Diagnosis Center,Nausea Nursing Diagnosis Center,Nausea Nursing Diagnosis Near Me
Neck Mass Differential Diagnosis,Neck Mass Differential Diagnosis Cost,Neck Mass Differential Diagnosis Center,Neck Mass Differential Diagnosis Center,Neck Mass Differential Diagnosis Near Me
Neck Pain Differential Diagnosis,Neck Pain Differential Diagnosis Cost,Neck Pain Differential Diagnosis Center,Neck Pain Differential Diagnosis Center,Neck Pain Differential Diagnosis Near Me
Neck Swelling Differential Diagnosis,Neck Swelling Differential Diagnosis Cost,Neck Swelling Differential Diagnosis Center,Neck Swelling Differential Diagnosis Center,Neck Swelling Differential Diagnosis Near Me
Neonatal Sepsis Diagnosis,Neonatal Sepsis Diagnosis Cost,Neonatal Sepsis Diagnosis Center,Neonatal Sepsis Diagnosis Center,Neonatal Sepsis Diagnosis Near Me
Nephrotic Syndrome Diagnosis,Nephrotic Syndrome Diagnosis Cost,Nephrotic Syndrome Diagnosis Center,Nephrotic Syndrome Diagnosis Center,Nephrotic Syndrome Diagnosis Near Me
Neuropathy Diagnosis,Neuropathy Diagnosis Cost,Neuropathy Diagnosis Center,Neuropathy Diagnosis Center,Neuropathy Diagnosis Near Me
Neurosyphilis Diagnosis,Neurosyphilis Diagnosis Cost,Neurosyphilis Diagnosis Center,Neurosyphilis Diagnosis Center,Neurosyphilis Diagnosis Near Me
Nhs Diagnosis,Nhs Diagnosis Cost,Nhs Diagnosis Center,Nhs Diagnosis Center,Nhs Diagnosis Near Me
Nhs Self Diagnosis,Nhs Self Diagnosis Cost,Nhs Self Diagnosis Center,Nhs Self Diagnosis Center,Nhs Self Diagnosis Near Me
Nmo Diagnosis,Nmo Diagnosis Cost,Nmo Diagnosis Center,Nmo Diagnosis Center,Nmo Diagnosis Near Me
Non Hodgkin'S Lymphoma Diagnosis,Non Hodgkin'S Lymphoma Diagnosis Cost,Non Hodgkin'S Lymphoma Diagnosis Center,Non Hodgkin'S Lymphoma Diagnosis Center,Non Hodgkin'S Lymphoma Diagnosis Near Me
Nph Diagnosis,Nph Diagnosis Cost,Nph Diagnosis Center,Nph Diagnosis Center,Nph Diagnosis Near Me
Nstemi Diagnosis,Nstemi Diagnosis Cost,Nstemi Diagnosis Center,Nstemi Diagnosis Center,Nstemi Diagnosis Near Me
Nursing Diagnosis For Depression,Nursing Diagnosis For Depression Cost,Nursing Diagnosis For Depression Center,Nursing Diagnosis For Depression Center,Nursing Diagnosis For Depression Near Me
Nursing Diagnosis For Diabetes,Nursing Diagnosis For Diabetes Cost,Nursing Diagnosis For Diabetes Center,Nursing Diagnosis For Diabetes Center,Nursing Diagnosis For Diabetes Near Me
Nyt Diagnosis,Nyt Diagnosis Cost,Nyt Diagnosis Center,Nyt Diagnosis Center,Nyt Diagnosis Near Me
Obstructive Sleep Apnea Diagnosis,Obstructive Sleep Apnea Diagnosis Cost,Obstructive Sleep Apnea Diagnosis Center,Obstructive Sleep Apnea Diagnosis Center,Obstructive Sleep Apnea Diagnosis Near Me
Online Diagnosis,Online Diagnosis Cost,Online Diagnosis Center,Online Diagnosis Center,Online Diagnosis Near Me
Online Medical Diagnosis,Online Medical Diagnosis Cost,Online Medical Diagnosis Center,Online Medical Diagnosis Center,Online Medical Diagnosis Near Me
Optic Neuritis Diagnosis,Optic Neuritis Diagnosis Cost,Optic Neuritis Diagnosis Center,Optic Neuritis Diagnosis Center,Optic Neuritis Diagnosis Near Me
Orthostatic Hypotension Diagnosis,Orthostatic Hypotension Diagnosis Cost,Orthostatic Hypotension Diagnosis Center,Orthostatic Hypotension Diagnosis Center,Orthostatic Hypotension Diagnosis Near Me
Osa Diagnosis,Osa Diagnosis Cost,Osa Diagnosis Center,Osa Diagnosis Center,Osa Diagnosis Near Me
Osteoarthritis Diagnosis,Osteoarthritis Diagnosis Cost,Osteoarthritis Diagnosis Center,Osteoarthritis Diagnosis Center,Osteoarthritis Diagnosis Near Me
Osteoarthritis Differential Diagnosis,Osteoarthritis Differential Diagnosis Cost,Osteoarthritis Differential Diagnosis Center,Osteoarthritis Differential Diagnosis Center,Osteoarthritis Differential Diagnosis Near Me
Osteomyelitis Diagnosis,Osteomyelitis Diagnosis Cost,Osteomyelitis Diagnosis Center,Osteomyelitis Diagnosis Center,Osteomyelitis Diagnosis Near Me
Osteopenia Diagnosis,Osteopenia Diagnosis Cost,Osteopenia Diagnosis Center,Osteopenia Diagnosis Center,Osteopenia Diagnosis Near Me
Osteoporosis Diagnosis,Osteoporosis Diagnosis Cost,Osteoporosis Diagnosis Center,Osteoporosis Diagnosis Center,Osteoporosis Diagnosis Near Me
Otitis Media Diagnosis,Otitis Media Diagnosis Cost,Otitis Media Diagnosis Center,Otitis Media Diagnosis Center,Otitis Media Diagnosis Near Me
Ovarian Cancer Diagnosis,Ovarian Cancer Diagnosis Cost,Ovarian Cancer Diagnosis Center,Ovarian Cancer Diagnosis Center,Ovarian Cancer Diagnosis Near Me
Ovarian Cyst Diagnosis,Ovarian Cyst Diagnosis Cost,Ovarian Cyst Diagnosis Center,Ovarian Cyst Diagnosis Center,Ovarian Cyst Diagnosis Near Me
Ovarian Torsion Diagnosis,Ovarian Torsion Diagnosis Cost,Ovarian Torsion Diagnosis Center,Ovarian Torsion Diagnosis Center,Ovarian Torsion Diagnosis Near Me
Pad Diagnosis,Pad Diagnosis Cost,Pad Diagnosis Center,Pad Diagnosis Center,Pad Diagnosis Near Me
Pain Diagnosis,Pain Diagnosis Cost,Pain Diagnosis Center,Pain Diagnosis Center,Pain Diagnosis Near Me
Palpitations Differential Diagnosis,Palpitations Differential Diagnosis Cost,Palpitations Differential Diagnosis Center,Palpitations Differential Diagnosis Center,Palpitations Differential Diagnosis Near Me
Pancreas Lesions Diagnosis,Pancreas Lesions Diagnosis Cost,Pancreas Lesions Diagnosis Center,Pancreas Lesions Diagnosis Center,Pancreas Lesions Diagnosis Near Me
Pancreatic Cancer Diagnosis,Pancreatic Cancer Diagnosis Cost,Pancreatic Cancer Diagnosis Center,Pancreatic Cancer Diagnosis Center,Pancreatic Cancer Diagnosis Near Me
Pancreatic Insufficiency Diagnosis,Pancreatic Insufficiency Diagnosis Cost,Pancreatic Insufficiency Diagnosis Center,Pancreatic Insufficiency Diagnosis Center,Pancreatic Insufficiency Diagnosis Near Me
Pancreatitis Diagnosis,Pancreatitis Diagnosis Cost,Pancreatitis Diagnosis Center,Pancreatitis Diagnosis Center,Pancreatitis Diagnosis Near Me
Pancreatitis Nursing Diagnosis,Pancreatitis Nursing Diagnosis Cost,Pancreatitis Nursing Diagnosis Center,Pancreatitis Nursing Diagnosis Center,Pancreatitis Nursing Diagnosis Near Me
Pancytopenia Differential Diagnosis,Pancytopenia Differential Diagnosis Cost,Pancytopenia Differential Diagnosis Center,Pancytopenia Differential Diagnosis Center,Pancytopenia Differential Diagnosis Near Me
Pandas Diagnosis,Pandas Diagnosis Cost,Pandas Diagnosis Center,Pandas Diagnosis Center,Pandas Diagnosis Near Me
Panic Disorder Diagnosis,Panic Disorder Diagnosis Cost,Panic Disorder Diagnosis Center,Panic Disorder Diagnosis Center,Panic Disorder Diagnosis Near Me
Pans Diagnosis,Pans Diagnosis Cost,Pans Diagnosis Center,Pans Diagnosis Center,Pans Diagnosis Near Me
Parkinson'S Diagnosis,Parkinson'S Diagnosis Cost,Parkinson'S Diagnosis Center,Parkinson'S Diagnosis Center,Parkinson'S Diagnosis Near Me
Parkinson'S Disease Diagnosis,Parkinson'S Disease Diagnosis Cost,Parkinson'S Disease Diagnosis Center,Parkinson'S Disease Diagnosis Center,Parkinson'S Disease Diagnosis Near Me
Pathological Diagnosis,Pathological Diagnosis Cost,Pathological Diagnosis Center,Pathological Diagnosis Center,Pathological Diagnosis Near Me
Patient Diagnosis,Patient Diagnosis Cost,Patient Diagnosis Center,Patient Diagnosis Center,Patient Diagnosis Near Me
Pbc Diagnosis,Pbc Diagnosis Cost,Pbc Diagnosis Center,Pbc Diagnosis Center,Pbc Diagnosis Near Me
Pcp Diagnosis,Pcp Diagnosis Cost,Pcp Diagnosis Center,Pcp Diagnosis Center,Pcp Diagnosis Near Me
Pe Diagnosis,Pe Diagnosis Cost,Pe Diagnosis Center,Pe Diagnosis Center,Pe Diagnosis Near Me
Pediatric Joint Pain Differential Diagnosis,Pediatric Joint Pain Differential Diagnosis Cost,Pediatric Joint Pain Differential Diagnosis Center,Pediatric Joint Pain Differential Diagnosis Center,Pediatric Joint Pain Differential Diagnosis Near Me
Pelvic Congestion Syndrome Diagnosis,Pelvic Congestion Syndrome Diagnosis Cost,Pelvic Congestion Syndrome Diagnosis Center,Pelvic Congestion Syndrome Diagnosis Center,Pelvic Congestion Syndrome Diagnosis Near Me
Pelvic Inflammatory Disease Diagnosis,Pelvic Inflammatory Disease Diagnosis Cost,Pelvic Inflammatory Disease Diagnosis Center,Pelvic Inflammatory Disease Diagnosis Center,Pelvic Inflammatory Disease Diagnosis Near Me
Pelvic Mass Differential Diagnosis,Pelvic Mass Differential Diagnosis Cost,Pelvic Mass Differential Diagnosis Center,Pelvic Mass Differential Diagnosis Center,Pelvic Mass Differential Diagnosis Near Me
